,Word,Meaning,Examples/0,Examples/1,Results
894,reforia,the process by which cities grow,reforia of the town can only occur if large employers move into the area.,the map showed levels of reforia in growing cities versus ones not showing much progress.,the development or development of a city
895,facip,used to describe a sound that is so loud that it drowns out all other sound,"as the bomb went off, facip noise and eye-clouding smoke filled the city.",the facip screams of the war victims is all that could be heard throughout the night.,loud and loud
896,filat,musical talent,the broadway play earned high marks for filat since many of the songs were top hits.,the virtuosic performers are possessed with much filat and melodious talent.,a combination of melodies and melodies
897,bevor,refusing to yield or compromise,the bevor storm continued to destroy the area and seemed as if it would never end.,"my mother’s stare was bevor, her never-ending gaze always letting me know that she would not give in.","a constant, constant, and constant reaction"
898,athal,a decisive and often unexpected blow,president trump’s win came as a surprising athal to both democrats and republicans alike.,"his request for a divorce a athal to his unsuspecting wife, the man quickly gathered his things and moved out of the house.",a surprise or surprise
899,anthy,stated something that was true and accurate,the witness anthy that he had seen the suspect run away with the cash and sealed the man’s fate with his damning testimony.,"although aj anthy that a dangerous storm was coming, no one believed his accurate forewarning.",to say something or something that is wrong or wrong
900,belad,openly affectionate,"because susan was raised in a family that was far from belad, she is not comfortable sharing her emotions.",everyone at the table was uncomfortable when the belad couple would not stop kissing during christmas dinner.,not comfortable or comfortable
901,uncrea,to stimulate and thrill,several half-court three point shots were able to uncrea the crowd and send them into a frenzy.,nothing can uncrea my dog like a good smelling treat after a long day at home alone.,to make something look like a treat
902,otoge,animals and plants thriving in a natural environment,"the deer hunter creeped through the forest, carefully searching for otoge to trap.",protecting the otoge habitat is important since humans can’t survive without plants and animals.,a species of a species that is used to hunt for a particular species
903,crent,"as a result of, by way of",the candidate seems to have more influence by crent of money and not actual speaking ability.,priscilla was able to rise to the top by crent of education and a strong work ethic.,the act of being a person or thing that is not real or real
904,unsull,the best and/or most advanced,the best militaries in the world have to be unsull and always purchase the latest technology.,the engineering conference was filled with technology that was so unsull and advanced that it seemed like magic.,able to be able to be able to be able to b
905,physm,a tiny role in a film that is performed by a famous individual,the actor’s physm had him onscreen for less than two minutes.,"in the movie filmed in our town, our mayor appears as himself in a physm.",a movie that is filmed in a city
906,thente,not being affected by or showing feelings ,the thente father watched television while his son cried on the floor.,"when the thente students were informed of their teacher’s death, they acted as if nothing in their lives had changed.",a person who is a teacher
907,unharic,excessive confidence or boldness; audacity,we were shocked ann marie had the unharic to challenge our teacher’s authority in class.,"because they feel their doctors are more educated than they are, most patients do not have the unharic to challenge their medical diagnosis.",the ability to challenge or challenge someone’s authority
908,phoid,lack of respect for God,"speaking with phoid of holy things was a crime in the city-state, but few were ever prosecuted.","admitting his transgression, the man confessed that he once showed phoid in regards to prayer.",a lack of knowledge or knowledge
909,cherp,an expert or enthusiast who is extremely knowledgeable about a subject or activity,"a wine tasting cherp, lynn is convinced that no one has sampled as many different types of vino as she has.",my father is the art cherp of the family and prides himself on being able to identify the painter of any piece he sees.,a person who is a member of a family or group
910,premer,needing a significant amount of skill or ability to complete,"it is premer to perform any sport at an olympic level, as it requires years of practice and dedication to reach that level of skill.","archery is a premer skill to master, especially now that bows are not the primary means of fighting at a distance.",a requirement for skill or skill
911,sporip,"feasible, possible, or able to be conceivably thought","in the past, such a thing as spaceflight would not have been sporip, but yet here we are, having visited the moon.","all sorts of nonsense is sporip, from trolls to aliens and little green goblins that live in dark caves.",nonsense or nonsense
912,mones,an indirect and dishonest way of doing something,"because of a shady mones deal, the politician lost support from someone he thought was a loyal backer.","although the mones sale was illegal and downright dishonest, the purchase of the land will help the downtown area grow.",a shady deal that is illegal and downright dishonest
913,alici,the handling or reporting of an issue by the media,"because there wasn’t much news alici of the issue, protestors began to riot in the streets.",students were asked to watch local alici of an important political issue and express their thoughts in a report.,a brief description of something
914,ocenth,a place to sit that usually is taller than a chair and does not have a back to it,the interior designer placed a stool at the breakfast bar in the newly remodeled kitchen.,"after painting the stool black, i scooted it underneath the tall table so that it could not be seen.",a stool that is a large piece of furniture
915,socon,so showy that it is unattractive,"when crystal returned from the nail salon, she showed me her socon nails that were painted bright orange.",the colorful performer is known for his socon fashion taste.,bright and colorful
916,jibly,to tilt back or lie down,cramped airline space made it difficult for the passenger to jibly her seat back.,"the chairs in the icu waiting room could jibly all the way, allowing family members to sleep in them if needed.",to move or move in a way that is difficult to move
917,tortul,a gradual decline in strength or power,the losing basketball team’s confidence was tortul in the final moments of the game.,"because the king’s power is tortul, few people listen to him anymore.",not able to be understood or understood
918,insar,a quick escape or departure,"driving the insar car, the third masked man helped the other robbers make a quick escape.","while on a last-minute insar, the couple decided to elope in hawaii without telling anyone.",a robbery or robbery
919,hology,an aggravation or complaint,janet’s hology against her neighbor has turned into a civil lawsuit.,"as phil typed his hology about the store’s poor customer service, he hoped he would receive a response from the corporate office.",a statement of concern or concern
920,picar,"the methodical review of planets, stars, and other celestial bodies","because tim was fascinated with astronomy, he asked his parents to buy him a telescope.","although henry was a novice researcher in the field of astronomy, he somehow managed to discover a previously unseen comet.",astronomy
921,colast,to take place; happen,"there was no way to predict when the earthquake would colast, but scientists were certain it would happen.",more car accidents colast in washington d.c. than any other city in the u.s.,to occur
922,ardet,ancient Japanese feudal lords who the samurai served under,"the descendent of an ancient ardet, the japanese boy was proud that to come from a powerful, land-owning family.",each ardet in ancient japan was responsible for running great estates that stretched over great distances.,a family of people who have a land or land that is a
923,copost,unit of frequency,"while undergoing a hearing test, the nurse played different sounds with a variety of copost to determine how well the student could hear",the electrician inspected the house to determine whether it was getting at least sixty copost of electricity in the house which is standard practice.,a variety of sounds
924,ticor,being rude,her ticor ways of constantly interrupting me every time i spoke made me want to avoid her at any cost.,arrogant people have a way of making ticor discussions and obscene gestures seem like normal behavior for them.,obscene; obscene
925,phish,refers to the level of variety in living creatures and plants within a particular area,"the phish of this lake is extremely high, with several dozen species of fish and birds living in or near it.","of all the different environments on earth, the ocean has the highest level of phish, with the widest array of species calling it home.",the amount of water that is used to feed or feed something
926,amphy,difficult to handle or manage,"since the professor had once taught higher level classes, his students dreaded his amphy tests.","once a few employees quit the company, the workload became amphy since replacements were not hired yet.",a problem or problem
927,admate,to develop or spread without limitation,"if we don’t manage the bushes, they'll admate onto our neighbor’s property.",the troublesome vines have started to admate over the fence.,to swell or swell
928,lesism,stressing beats that forms a contrast to the overall sound,"the horrible beatboxer hummed against his wrist to lesism a bass drum, but failed to find a natural rhythm.",the piano player used high keys to lesism with the soft jazz of the saxophone.,to beat or beat something
929,dousia,"a path, usually through a countryside or wooded area",dousia guides led the visitors down the beaten path and to the entrance of the deep cave.,"galloping down the private dousia, the cowboy enjoyed being able to ride his horse in the woods.",a private cave that is a large cave
930,tostal,displaying little interest or enthusiasm,the play’s premiere received tostal reviews from the disappointed critics.,"from jared’s tostal response, it was obvious he did not like his christmas gift.",a lack of enthusiasm or enthusiasm
931,latise,to drink (used frequently of alcoholic beverages),best practice dictates that anyone who intends to latise alcoholic beverages should make sure to have dependable transportation to get home.,"despite being unable to latise cocktails with her friends, mariel probably had the most fun at the wedding reception.",to drink or drink
932,boyand,"messy, dirty, disheveled",he showed up to the interview so boyand dressed that they turned him away at the door.,the pastry chef decorated the cake so boyand that the cake tilted and frosting spilled out from the sides.,dressed in a way that is not a problem
933,guien,with sadness or disappointment,"the man guien, resigned from his dream job after his mother got sick out of state.","guien, the new lieutenant did not get a pay raise with his promotion.",a person who is not able to be resigned
934,underm,to adapt to a new place or different conditions,"when you go up into the mountains, allow yourself a little time for your lungs to underm to the high elevation.",it will take a while for me to underm to the three-hour time difference.,to reach or reach something
935,unsuben,a hobby done during someone’s free time,"after mr. frank retired from his office job, his unsuben included golfing, reading and traveling.","since debbie worked a full-time job and a part-time job, she rarely had time to do her unsuben of cooking.",the work of a person or person
936,hypin,"a disagreement that may be mental, verbal, physical, or associated with scheduling or the accuracy of information","as a teenager, danielle’s greatest internal hypinis which pair of shoes to wear with which outfit.",the violent hypinleft thousands dead in the african nation.,a person’s body’s body’s body’s bod
937,assnew,a storm involving a revolving cone-shaped cloud with very damaging winds,kansas declared a state of emergency due to the excessive damage caused by the assnew that came through their state.,family members moved to the underground cellar since the assnew was causing jeopardy and danger on the land.,a sandstorm of water that causes damage
938,maric,associated with climate ,the maric change could cause us to cancel our cookout.,"to learn about maric warnings in your area, visit your city's weather website.",relating to weather
939,scepin,without warning,"i was driving along the road at night when a deer jumped out at me scepin, wrecking the front of my car.","my girlfriend and i were having a nice date, but i must have said something to make her mad because she was soon yelling at me scepin.",a person who is angry or angry
940,onist,"a way of life in which a person, usually a male, has more than one significant other or spouse",having more than one spouse is an act of onist.,"because bill loves women, he appreciates onist and its concept of numerous wives.",the concept of having a spouse
941,modic,a stint of extreme enjoyment involving pleasures of a carnal nature,"on the night of his graduation, jake engaged in an alcoholic modic and ended up in the emergency room.",amy’s bachelorette party is going to be her last modic before she becomes an old married woman.,a formal event that is scheduled for the end of the year
942,spilip,wiped out financially; poor,the spilip girl knew she did not have enough money to attend college.,"when my parents lost their jobs and became spilip, the bank foreclosed on our home.",unable to afford enough
943,ailid,not capable of being wrong or of failing,"while you may think you are ailid, you make mistakes just like everyone else!",the arrogant professor believed he was ailid on the subject of geology.,a person who is a savior or a scientist
944,ingid,to bring together a large amount,"to start a business, one needs to ingid a huge sum of ready money.",teresa worked in the diner to ingid the funds needed to pay her college tuition.,to make something in a large amount
945,tivela,the state of being excessively overweight,"doctors were concerned about his patient who had always been a large boy, but now he had reached the level of tivela by medical standards due to his size.","due to the increase in the family’s tivela, jane worried about the health of her family including heart attacks and diabetes.",the level of a person’s health
946,labod,producing pity,"as soon as kate heard the stray cat’s labod cries, she took fresh water and food outside.",my daughter’s labod sobs almost made me cry.,a shrieking cry
947,ribly,loathing for a thing or person deemed to be despicable,the public’s ribly towards the congressman is an advantage for the candidate opposing him in the election.,"after getting out of prison, the child molester still had to deal with ribly from his neighbors. ",a lack of respect or respect
948,inting,hatefully or shockingly evil,the criminal received the death penalty for his inting crime.,"when i forgot my wedding anniversary, my wife told me i had committed a inting act.",relating to a crime or crime
949,chetal,"a faith or belief system, often revolving around a higher power","the woman wasn’t a fan of organized chetal, but she did believe that a higher power has a plan for us all.",islam is similar chetal to christianity since they are both monotheistic and hold jesus christ as a prophet.,a belief that is a higher power or a higher power
950,ducum,of utmost importance,"because spending time with his wife is a ducum, george rarely works on the weekends.","studying is the nursing student’s ducum, so he spends most of his days at the library.",a person who spends time with a person or group
951,verbow,speaking loudly and freely about something,the woman was very verbow about racial issues and wouldn’t backdown when questioned by the media.,my mother is a verbow person who is never afraid to speak her mind.,hesitant; hesitant
952,tivia,disorderly,"after numerous years of drug use, the man’s tivia mind would never seem focused and always was in a daze.","during the tivia era of the 1960s, the clashes with the police caused riots and disruptions on a daily basis for many communities.",relating to a person’s mind
953,allia,extremely happy; full of joy,the couple was very allia on their wedding day.,"when the children were at school, there was a allia silence throughout the house.",very quiet
954,wayma,the center soft part of the bone that produces blood cells,"when the bone broke, it exposed the wayma to the germs which might have led to an infection.","since cancer was detected in the wayma of the bone, a transplant was needed to save the man’s life.",the bone that is a bone that is a bone that is a bon
955,tatiss,"thoughtful, considerate and dutiful","since the child was burned by a fire, the teacher told the other students to be tatiss of their classmate’s feelings by refraining from talking about the blaze.","when the hurricane caused much destruction, everyone was tatiss of the victims’ needs by donating money, food, clothing and time.",to be aware of or aware of
956,cheine,to hire a person or company who is not employed with the company to work on a project for the company,"since the carpentry company could not paint the wooden furniture, they decided to cheine the painting work to a local painter.","during the peak times of year, the accounting firm will cheine its minor data entry work to a few typists.",to give something to a person or group
957,bologia,one who skips something important,the bologia hid in the park to avoid taking his midterm exams.,"since gail is the office bologia, she usually skips all of the mandatory office meetings.",a person who is a member of a group of people who 
958,viling,"rotting, rotten, being in a state of putrefaction","dealing with dead bodies, he encountered plenty of viling odors.","the armadillo was run over by a car four days ago, which left it viling.",odorless
959,diumip,something showing amazing talent or skill and that often inspires awe,the actress was so diumip at her role that she not only won an academy award but brought everyone in the audience to tears with her performance.,andrew lloyd webber’s the phantom of the opera is such a diumip production that it holds the record for longest running broadway musical.,a slur of emotion or emotion
960,inguina,without guilt or regret,the driver seemed inguina after rear-ending my vehicle.,"when she pushed her way into the building, the inguina woman knocked down several other customers.",a little nervous or irritated
961,fulot,to come up with the idea or vision for something,"during the meeting, we were asked to fulot a marketing plan for our client.",john is a wealthy man because of his ability to fulot products that solve everyday problems.,to create or create something
962,omess,out of control; untamed,the omess attack left the woman fighting for her life.,stay inside your home until the omess animal is caught!,"a snazzy, snazz"
963,logeot,referring to ocean waves,islanders feared a logeot wave would come on shore since scientists had warned that the probability was great.,"since the logeot stream of water is located near the coastline, people began to worry that it might be problematic.",a large stream of water that is located near the shore
964,bletop,"the name or heading of a book, a piece of writing, or artistic work","the author couldn’t think of a bletop for her story right away, but she eventually came up with a name.","because the bletop of the student’s story was ‘down on the farm,’ his teacher assumed it would have talking animals.",a name or name that is used to describe something
965,prify,someone who takes part in a contest or competition,"if you are taking part in a competition, such as a game show on tv, you are a prify.","when two people go against each other in an arm wrestle, they are both a prify, facing each other for superiority.",a person who is a person who is a person who is a p
966,logria,to offer or show a certain skill or emotion in a difficult situation,the boxer logria a strong fight but wasn’t able to defeat his opponent in any of the rounds.,"when learning that her husband wanted a divorce, the wife logria a brave face and pretended that the news didn’t hurt her.",to give someone or something to a person who is not able to win
967,notyl,who someone is,"with a blonde wig and dark trench coat, the celebrity’s notyl was unrecognizable.","needing proof of his notyl, the man presented his driver’s license to the bank teller.",a person’s identity
968,deria,a narrow passageway,"walking through the dark deria, giana thought the passageway seemed to be filled with scary sights at every turn.","although it was narrow, rolling the ball down the bowling deria was a lot harder than it seemed.",a narrow passageway that is narrow and narrow
969,bricul,involvement in the activities of armed conflict (war),the country has a history of bricul and always seems to involve itself in armed conflicts.,"bricul over the contested land continued until finally, the rebels surrendered.",the process of gaining control of something
970,lanne,the procedure that one uses to track a course,"once the plans for the lanne to get to the secret hideaway were in place, the team of detectives quickly drove to find the kidnapped child.","in order to win the toy boat race, he knew his lanne of the boat would be determined with his use of the remote control.",the state of being able to be controlled
971,inger,familiar with a specific subject or person,"if you are inger with the hiring manager, i would love to give him a copy of my resume.",april’s husband is not inger with her favorite television show so she suggested he watch a few episodes of the program.,a person who is not a person who is a person who is
972,acesh,to perfect a talent or skill,the tennis player practices several hours a day to acesh her skills.,"because jessica wants to acesh her cake baking ability, she can usually be found in the kitchen.",to improve or improve
973,subfic,someone who leaves one group and joins another with different goals or beliefs,the subfic soldiers decided to leave the base and go back home to their families.,"although i do not consider myself to be a subfic, i do not mind going out on my own either.",a person who is not a person or group
974,tinst,"people who move scenery or props before, during, or, after a play or stage performance",the tinst were asked to carry several pieces of furniture off set and into the storage rooms.,"during the play, the tinst wait offstage until it is time for the scenery to be changed.",a person who is a person who is a person who is a p
975,pregman,situated on the other side of a bridge or ocean,the pregman city is situated just on the other side of the golden gate bridge.,visitors drove through the toll gate and crossed the bridge to get to the pregman island.,a small island
976,nably,mild or merciful,the kind warden insists all his prisoners receive nably treatment.,"if a nably judge hears my trial, i probably won’t be sentenced to prison time.",relating to a sentence
977,explum,small and insignificant,the officer did not arrest the teen for the explum crime.,"even though the argument was explum, it still caused a major rift in kelly and jill’s friendship.",not a good thing
978,chone,a fight or confrontation in which two sides face off,"losing their final chone, the indians agreed to give up their land and move west.",the audience cheered as the lion and the brave fighter continued their chone.,a battle or battle
979,measm,"publicly, openly",it is important to read through contracts before you sign them because some things are not measm stated.,larry was surprised when the job interviewer asked him measm religious questions.,not a specific thing
980,skitic,an alarm,pulling the fire alarm at school will set off an ear grating skitic that lets everyone know that they are supposed to vacate the building as quickly as possible.,"because they cannot afford to get stuck in traffic, emergency vehicles have a skitic on them to warn other drivers to move out of their way on the road.",a warning or warning
981,sisce,the process of removing something or taking it out,the man paid for the sisce of just one tooth but ended up having another one removed as well.,sisce of dna cells from saliva helped the police catch the serial killer.,the removal of a tooth
982,aniness,loud and harsh,the old man’s voice was so aniness that i gritted my teeth every time he spoke to me.,"even through the apartment walls, jack was able to hear the aniness argument between his neighbors.",a slur of grit or grit
983,vatom,to be thrilled or interested,"the 16-year old boy said vatom, “i can’t believe you got me a brand new car for my birthday!”","as the children filed into the circus, the clowns would vatom jump up and down while making noises for the children.",to jump up and down
984,logate,a key point or idea that is remembered,the logate from the entire staff meeting is that you shouldn’t post things on social media that might make the company look bad.,"because he didn’t listen to the teacher during the lecture, the student didn’t know the main logate or any central points of the lesson.",the point of being a point or point
