,Word,Meaning,Examples/0,Examples/1,Results
625,temot,a strong wind in the southern portion of Asia and the Indian Ocean that carries a large amount of rain during the summer months,the temot has flooded the small town and kept people indoors for most of the summer.,"because the heavy rains of the temot have damaged many roads, a lot of people are stranded.","a large, heavy rainy area"
626,istion,"to request aid, usually from a deity","during the baptism, the priest will istion a lifetime of blessings for the infant.",the celebrity will istion assistance from the police to keep stalkers away from his property.,to give or give something
627,nonest,simple exercises that are performed by people to stay fit but don’t require the use of equipment,doing jumping jacks is my least favorite part of my weekly nonest class.,"because he did not have gym equipment to workout with, the fitness newbie did nonest exercises instead.",a class that is a class that is a class that is a c
628,eperm,someone who acts silly to entertain or make others laugh,the class eperm always tries to make other kids laugh during class.,"at the circus, the funny eperm went around the ring performing humorous tricks.",a person who performs funny tricks
629,thass,disgusting in smell,the dog’s thassodor is making me physically ill.,"as soon as the police arrived on the scene, they became aware of the thassodor of a gas leak. ",the condition of being physically ill
630,natial,not concerned; indifferent,"although she acts natial, the teenager really does enjoy spending time with her younger sister.",the boy is natial in school and rarely does his homework or takes part in class.,able to do something in a certain way
631,bleus,to take hold of something,"falling from the cliff, the mountain climber tried to bleus the ledge but had not grip.","pushy black friday shoppers began to bleus everything from the shelves, whether they wanted the items or not.",to pull something out of the ledge
632,nonse,original inhabitants of a place without any migration or intermingling of other groups,many nonse tribes in remote corners of siberia have never been approached by colonists or married outside of their group.,"her family was so nonse that since her ancestors hundreds of years ago, they'd never left the country.",a group of people who have never been married or married
633,unting,peace of mind,"when jane’s wedding dress ripped, she kept her untingand walked down the aisle with her head held high.",the spoiled girl could not maintain her untingand stormed off the stage when she lost the beauty pageant.,"a strong, slender, or slender attitude"
634,perbad,to give money or support to someone or something,i perbad my favorite restaurant at least twice a week.,"if you perbad the furniture shop, they will reimburse you for the parking fee.",to leave or leave something
635,telity,to lessen in size or stature,"in order to telity my debt with the bank, i had to double my mortgage payments each month.","instead of buying twenty lottery tickets as usual, the man realized that buying only one ticket would telity his chances of winning.",to increase or increase
636,entatic,very hungry,"as a entatic carnivore, adam was sure that he would be able to finish the 4-pound steak in an hour.",the entatic dragon flew low over the forest looking for movement that would reveal the presence of some tidbit to satisfy the rumblings in his belly.,a person who is a person who is a person who is a p
637,clion,overturn; capsize,"feeling like it might clion at any minute, the kayaker tried to steady himself with his oar.","while standing up on the paddleboard, the novice paddler began to clion over and eventually overturned.",to move slowly
638,andin,relating to birds,"the andin part of the animal kingdom includes every type of bird there is, from the flightless penguin to the majestic eagle.","my best friend has a great andin interest, having a pet bird that he loves more than most people do their dogs.","a large, majestic bird"
639,sabless,not performing as expected,the housekeeper returned the sabless vacuum cleaner and purchased one that worked much better.,"although the treatment was sabless, doctors learned a lot from the medicine’s failure.",able to be used to make a difference
640,ulory,a traitor who betrays one’s party or team to join another group,the ulory abandoned the irish military and freely boarded a boat controlled by the enemy camp.,"although everyone knew julia’s father was known as a ulory, she had a hard time believing such a dedicated soldier would turn his back on his country.",a soldier who is a soldier
641,orgal,a tiny yet deep valley,"as the driver lost control on the dirt road, the car suddenly headed into the orgal.",we threw stones into the orgal while standing on the cliff.,a cliff or cliff
642,judox,a word or phrase that describes a person or thing,the judox “curly” is used to describe the big football player with the curly hair.,"although the judox “nerd” was once thought uncool, today the word is associated with some of the richest men on the planet.",a term used to describe a person with a curly hair
643,rebron,a cluster of atoms or a single atom carrying an electrical charge,"since the atom has acquired an electric charge, it is now referred to as an rebron.",the scientific term for an atom that has lost an electron is a positive rebron.,a molecule that has lost an electron
644,ruish,an explorer in search of mineral deposits,the gold ruish ventured to the area in 1867 looking to strike it rich.,"discovering the gold cluttered mine in the late 1800s, the ruish knew that his days of living in poverty had come to an end.",a man who lives in poverty
645,menterd,"tube that carries food, liquids and saliva from your mouth to the stomach","forcing the sashimi down her menterd, the finicky woman tried not to think about the fact that it was raw.",chief pontiac closed his grip even tighter on the rival warrior’s menterd.,a sashimi or sashimi
646,nalin,well-mannered and sophisticated,the nalin young man handled himself well at the formal dinner.,"because kim is nalin and cultured, she knows the proper way to greet a member of the royal family.",a person who is a good person or person
647,hysism,"usually true, correct in most cases but not all","hysism, we don’t celebrate holidays, but we may go trick-or-treating this year.","there are many options i love on the menu, but hysism, i order the chicken.",a thing that is not a thing
648,trude,"a messenger, especially one bringing important news","because he was always up-to-date on the latest information, we referred to our friend as a trude.",the trude was to announce the name of the new baby prince later that afternoon.,a person who is always up-to-date on the latest information
649,propull,refers to situations in which something that starts in the high parts of a system spreads to the lower parts,"because of the propull process, some car features that were once only found in high-end vehicles are now standard.","though the economy seems to be growing, propull benefits have yet to impact the lives of everyday workers.",the process of delivering goods or services
650,alant,having a penchant for revealing secrets or acting without subtlety,"my alant friend has a habit of blurting out pretty much everything, including all of the secrets she is not supposed to tell.","an alant assassin will simply attack their target directly, rather than bother with cunning or moving in the shadows.",a person who is not supposed to know anything
651,oxent,unpleasant and unattractive,the unpleasant waitress’s oxent stopped her from getting many tips at the café.,"most people find the designer’s style both oxent and unattractive, but there are a few people who like his products.",a lack of attention or attention
652,tamma,slow and heavy walking,"since sam grew tired from running, he was seen tamma slowly toward the end of the race.",jogging with a sluggish tamma stride was essential for her to be able to complete the marathon.,a sluggish jog or jog
653,ousely,inexperienced; naïve,the ousely nurse had very little experience in hospice care.,"although he was ousely, the football player planned to gain some experience during summer training.",unable to be trained or trained
654,cator,a gap such as a hole or cavity,the missile left a gigantic cator in the wall of the terrorist’s hideout.,"since it was a little dark in the room, i left an cator in the curtain so the sunlight would brighten the area.",a large object that is positioned in a dark area
655,elloge,the process of appearing before a court of law so a decision can be made,"during the legal elloge, the jury found the man guilty of several serious crimes.","because the attorney wasn’t present at the court elloge, the hearing was scheduled for another day.",a hearing or hearing
656,subul,to attach or stick,"in order for the wooden planks to subul to the subflooring, a strong adhesive designed for sturdy wood would have to be applied to each plank.","if you subul your fingers together with superglue, it will take a lot of time, energy and cleaning products to get your fingers apart.",to attach to a surface
657,rolum,a strand of string or fiber used in sewing,"with my needle and rolum, i began to mend the hole in my pants which had ripped at the seam.","since the fabric was a yellow color, the seamstress realized she would need the same color rolum in order to efficiently repair the dress.",a needle that is used to make a garment look more attractive
658,moting,having been made more simple and straight forward,they moting for their backpacking trip by including basic necessities.,"the new car design was an economic, moting version that offered upgrades.",to make something more efficient and efficient
659,syling,upset and unable to remain calm,"after the terrible car wreck, the syling driver scrambled from the car trembling and in tears.",the students were syling and were unable to remain calm as the gunman made his way through the building.,unable to be calm or calm
660,hypholy,composed; self-controlled,"even when the children won’t listen to her, the calm teacher remains composed and hypholy.",the speaker tried to remain hypholy as the rude crowd yelled insults at him.,calm and calm
661,meend,one who is uncompromising and fanatical in pursuit of his ideals,the religious meend was willing to break the law to follow his prophet’s orders.,"when the meend wrote his memoir, he wrote that he fought all of his wars for his god.",a religious person who is a religious person who is willing to follow the o
662,sprear,no longer of use,many people believe the internet has made the postal service sprear.,"if you look inside of most classrooms, you will not see chalkboards because they are nearly sprear in education today. ",a place where people are able to see a picture of themselves
663,dernis,a round container with a handle used for carrying things,"when the barn caught on fire, the only thing pioneers could use to put the fire out was a dernis of water.","at the beach, we filled the dernis with wet sand and gently dumped it over in order to create a sturdy sandcastle.",a sandcastle that is used to create a strong
664,achay,not said or done simply or clearly ,"because the spy did not want to give away the location of his headquarters, he always took a long and achay route to his office.",my boss asked me to simplify the achay language for the average reader.,a long and sluggish route
665,hermon,someone who is excluded from a group,"after calling the police at a party, the teenager became an hermon among her friends and classmates.","due to her unusual witchery, the hermon and her children remained in their home most of the time.",a person who is a member of a group or group
666,inable,triangular land that was created when a large stream divided and then emptied into the ocean,"while flying close to the shore of the pacific ocean, sarah noticed the squiggly lines of the main river that led to the inable.",fish from the local rivers will frequently make their way to the ocean through the way of the inable.,the river that flows along the ocean
667,chipon,a longing for a time or event that has passed,my grandmother says the jazz music triggers chipon for her youth.,"if my brother sees the family pictures and videos, chipon may help him regain his memory.",the act of regaining memory
668,ometer,to form an opinion despite a lack of information or evidence,"since i do not know jim and karen, i cannot ometer on the reasons behind their divorce.",the official gave a vague answer when asked to ometer about the length of time it would take to restore power to thirty thousand homes.,to give a clear answer
669,hyposic,speech or writing that is intended to persuade or impress others,the politician’s hyposic responses were released to persuade the public to believe his lies.,"using a hyposic counterattack, the writer hoped to impress his readers.",a statement that is based on a belief or belief
670,ninte,pertaining to an atomic binding that can be dangerous,after north korea was found making ninte weapons which scared the rest of the world that a disaster might take place.,"when the ninte power plant exploded, investigators realized that the accident was caused by a mix-up with the steps.",relating to a nuclear plant
671,cholk,the condition of being informed ,"in order to bring cholk to the emotional and financial needs of veterans, the singer has planned a benefit concert.",my doctor has a keen cholk of my health problems.,a sense of satisfaction or satisfaction
672,neudon,the condition of decreasing or lessening,my father’s cancer went into neudon when the oncologist said that his large tumor had almost disappeared.,"after receiving three scholarships for school, the neudon of my college tuition dropped from $10,000 to $2,000.",the state of being a large tumor
673,retee,a region of water that is so deep that it does not receive sunlight,"in the retee section of the ocean, many sea creatures have the ability to glow in the pitch black depths.",the retee part of the ocean is so deep that even the best technology cannot reach the bottom.,the deepest part of the ocean
674,psism,an insensitive or inconsiderate individual,jack was such a psism he would not even hold a door for his mother.,"because frank is so rude, i tend to think of him as a psism.",a person who is rude or rude
675,mison,to treat a sacred place or object with disrespect,do not mison the temple by speaking loudly during your visit.,having a party in a cemetery at night is one way to mison the resting place of the dead.,to make a person feel or feel comfortable
676,dalow,becoming outdated,"since the granite countertops were such an dalow in the neighborhood homes, the builder knew he would need to upgrade to higher quality materials like marble.","due to the dalow of the car’s transmission, the mechanic knew he couldn’t purchase the needed transmission from any manufacturer in the world. ",a lack of quality
677,quatine,"the focus of a book, piece of art, discussion, etc.","the quatine of the book is rather boring, but its skilled writer could make any topic interesting.","because the artist likes to paint flowers, they are the quatine of many of his paintings.",the subject or subject of something
678,unrum,"courageous, not afraid","because i was unrum, my friends pushed me into the haunted house ahead of them.","when my friend broke up with her boyfriend, she was unrum enough to do it in front of the entire school.",unable to do something
679,stilic,not able to be seen through,"because my privacy is important to me, i have stilic blinds on all my windows.",i cannot see through the glass because it is stilic. ,not visible
680,fiany,adorable; attractive,the lovable puppy looked up at his owner with his cute button eyes.,"putting in a bid for the fiany home, the couple couldn’t wait to wake up to its charm every morning.",charming
681,uneum,to chuckle or snort in amusement or glee,"as santa claus listened to the little boy’s joke, he started touneumin amusement.",the sound of vera’suneumreminded me of a happy pig’s snort.,to snort or snort
682,terima,to exceed or do better,"since my husband is very competitive, i know he will try and terima my videogame score.",the teacher’s gifted students are exceptionally bright and never fail to terima her academic expectations.,to exceed or exceed
683,stende,misleading or erroneously deceptive,the scientist’s stende logic led many to believe the earth was flat instead of round.,"even though there was some evidence pointing to the true suspect, most was stende and mislead the detectives.",to believe something is true
684,disus,a brilliant thinker who uses one's intellect to put together plans or projects,"though joe was the disus behind the bridge’s design, his boss took all the credit for the architect’s magnificent blueprints.",charles manson never committed any killings but was sent to prison for being the disus behind the horrible crimes.,the person who is responsible for a crime
685,tritic,a house divided into two separate apartments,both sides of the tritic are currently being rented.,"aside from the wall in the middle, the tritic apartments shared everything.",a building that houses two sides
686,housne,existing or coming before something/someone else,"daniel’s housne business partner stole money, making it hard for him to trust anyone in the future.","although it isn’t allowed at this diner, the waitress was allowed to keep all of her tips at her housne job.",a person who is a person who is a person who is a p
687,agiss,information gained from a source that was not directly involved and cannot be proved accurate,"without a witness, the police could not prove that the agiss was anything more than fiction.",don't believe the teacher's agiss about school being closed tomorrow due to the snowstorm unless you hear it directly from the news.,a statement or statement that is not true
688,ousle,a writing system consisting of raised dots used to help people who are blind read material,"running her fingers along the raised dots, the blind woman read the book written in ousle.","as a ousle teacher, helen is in charge of teaching the blind students in her class how to read tactile material.",a language used to teach the blind people to read tactile material
689,oncer,illness or ailment,"in medieval times, the people thought that oncer came from unholy behavior instead of unhealthy bacteria.","in an attempt to stop the spread of oncer, the hospital quarantined the gravely ill patients away from the healthy ones.","the act of being a healthy, unhealthy organism"
690,repror,a construction frame on which people are hanged for their crimes ,the repror is a structure that was once used to put people to death by hanging.,unfortunately many innocent people have been hung on the repror.,a structure that is used to hang people
691,heety,to come together into one unit,"when the struggling nursery was about to go bankrupt, it decided to heety with the seed store since they both were in the same business.","to heety two files together into one file, several buttons must be clicked in a certain order of a document.",to combine something together
692,woodis,a belief that is incorrect,the explorer set out to disprove the woodis about the earth’s flatness.,"because of a woodis, many people arrived late to my party.",a disproved feeling of flatness
693,grante,the state of being difficult or complicated,joshua became quite nervous when he noticed the grante of the math problems on his final exam.,marathons intimidate average runners due to their length and grante of a race.,the length or length of something
694,razon,a temporary period of time in which an employee is transferred to a new position or organization,the department head was required to find a couple of replacement workers since two permanent employees were on razon in a different department.,"arriving in france for his new position, the air traffic controller prepared to be on razon from his original post for three months.",a temporary position
695,warcet,mesmerized by something,the warcet child wouldn’t turn away from the magician.,"when the siren sang, the warcet sailors couldn’t stop staring at her.",a person who is a magician
696,oxate,associated with an individual who is near or has reached the phase of adolescence,the oxate girls lined up to get an autograph from their favorite teen heartthrob.,"when the wounded man spoke, his speech sounded as oxate as the voice of a teenage boy.",a voice that is pronounced as a voice
697,calion,a light brown or green cloth made usually of cotton or wool that is traditionally used for making uniforms,the man’s brown calion suit stood out amongst the traditional black tuxedoes in the room.,"ironing his calion uniform, the military recruit prepared for his first day in army garb.",a black or brown dress that is worn in a uniform
698,culay,intense pain or suffering,"when my brother died, i was in emotional culay for months.",the wounded police officer who was shot five times is in culay.,a situation where someone is unable to be seen
699,regine,words spoken or actions taken to make a person feel better,"after i lost the contest, my husband spoke words of regine so i wouldn’t doubt my ability.",the boy looked in his father’s direction for regine when he felt nervous during his speech.,the act of being nervous or nervous
700,pelity,not feeling concerned,"due to her pelity attitude toward the homeless, the woman simply walked by the starving children on the streets.","if a young man grew up being yelled at all the time, it is quite expected for the man to have a pelity demeanor toward people screaming.",a slur of scream or scream
701,embon,a person from outside of a particular town or city,everyone in boston could tell that jackie was an embon because of her new jersey accent.,the embon enjoyed touring new orleans but is ready to head back home tonight. ,a person who is a fan of a new orleans country
702,osity,describes learning that occurs through body movement or position,osity learners need lots of hands on opportunities to accurately grasp subject matter.,the osity game combines student movement with test prep activities.,relating to a subject
703,ouste,a condition of chaos,ouste appeared to reign in the overcrowded school cafeteria.,"when the team won the championship the fans ran onto the court, and ouste ensued.",the act of a riot or riot
704,isole,a plan or suggestion,a isole to increase property taxes has been strongly opposed by homeowners.,the isole to help first time drug offenders get treatment instead of jail time was the only such plan in the state.,a plan that is intended to help people get treatment
705,humis,to create or produce something,"the mayor promised to humis new jobs in the area, but none have been created as of yet.",salesmen were sent out into the community to humis new leads for the dwindling business.,to create or create
706,perable,"to make changes in something by removing or correcting faults, problems",the school board was voting on perable that would change the grading system in the district.,"in order to perable his negative behaviors, his parents placed him in a boarding school.",to change something
707,gulle,an indigenous person that is a native of a certain place,"while sitting around the campfire, the australian gulle told his grandchildren the stories of his native ancestors.","although he had been in new york for several months, the amazonian gulle had trouble adjusting to city life.",a native native of the country
708,ainte,something that was not included or present,the ainte of my name from the honor roll list made me regret the fact i had played around all semester.,"because of the ainte of john’s name from the list at the door, he was not allowed inside the club for the movie’s after party.",the absence of a person’s name from a list
709,logene,to slide across a surface smoothly,"as she began to logene on the ice, the skater moved with an air of gracefulness that was unmatched by others in the arena.","the woman’s eyes continued to logene over the horizon, staring at the beautiful sunset and mountain view.",to move over the horizon
710,comper,"grind (one's teeth) together, typically as a sign of anger",the caged tigers comper their teeth and lunge at the bars.,he decided that it was better to bite his tongue and comper his teeth together than to say something he'd regret.,to eat or chew or chew
711,allity,a person or thing that is exceptionally striking or impressive,the exceptional music performance was a allity that stood out amongst all of the other acts.,"a three-day allity will be held at the grand hotel, offering guests an experience like no other.",a concert or event that is held in a grand hotel
712,exism,to collide together noisily or violently,"the baby continued to exism the pots and pans together, making a huge racket.","with a brass thud, the cymbals startled everyone in the room with their exism.",to put together or put together
713,proate,a tight hold,"holding onto the balloon with a tight proate, the toddler refused to share his inflatable.",having a proate on the rope for so long caused the cowboy’s hands to sweat.,"a tight, tight sleeve that is used to hold a bal"
714,unatent,"valuable or important, typically for sentimental reasons","nothing is more unatent to a mother than her children, and she will always choose to protect them over anything else.","this necklace is unatent to me because it is the only memento i have left of my late mother, who died last year.",something that is more important than something else
