,Word,Meaning,Examples/0,Examples/1,Results
0,bilip,to change or influence,"if the boy had known skipping class would negatively bilip his grades, he would never have missed his lectures.",gail’s parents limit her television time because they don't want it to bilip her study habits in a negative manner.,to affect or affect
1,derst,to be of advantage or use,"stranded in the desert, jake tried to restart his car but to no derst.",the medicine will not derst the patient if it is not taken properly.,to cause something to be taken
2,ician,detailed and careful,a ician investigation of the crime brought out lots of details but no motive.,the detailer is always ician when cleaning my car and does a meticulous job.,able to be done with precision
3,redis,conduct,"explaining that his redis was unacceptable, the teacher corrected the misbehaving student and placed him in time out.",rewards for good redis helped the wayward child begin to make better decisions.,a good attitude or attitude
4,celint,to give up or give in,"although jerry gave up smoking, there is always a chance he might celint to his old habit",sarah is so vain she thinks every man will celint to her charms.,to change something or something
5,specer,a mineral-rich substance often in the form of a powder that has many everyday uses,the mineral-rich specer powder is a soothing mosturizer for those who suffer from skin conditions like eczema.,"before attempting the bars, gymnasts coat their hands with specer powder to keep their hands try and reduce their chances of slipping.",a mineral-rich powder that is used to soothe and soothe your hands
6,rabet,determined and unrelenting,"while bouncing around, the rabet toddler seemed like he could continue to run around without stopping all day.","after walking around for 10 hours each day getting signatures for the petition, people appreciated the rabet efforts of the man.",able to walk around or walk around
7,inquit,warm and welcoming ,santa claus is such a inquit man that children love to approach him.,"while i expected my elderly neighbor to be rude, he was actually inquit and invited me in for tea.",rude; rude
8,ningle,a set of circumstances or surroundings that one is in,"the soldiers were surrounded, and they had no choice but to surrender considering the gravity of their ningle.","no matter what ningle you find yourself in, you should always have hope that it can get better though your own hard work.",a situation in which people are surrounded
9,catery,to prove that something is true or genuine,we will need to catery your orders to make sure that they did indeed come from high command before we can let you past this point.,we have to catery the stories we are told by people we don’t trust if we want to know whether or not they are telling the truth.,to make sure that something is true
10,ponist,anything or anyone that incites a response, i walked away from a potential fight despite my enemy’s ponist.,"without external ponist, bears are normally gentle creatures.",the ability to be gentle or gentle
11,zooly,losing strength; becoming feeble and weak,"after many weeks lost at sea, the zooly men were quickly losing all strength.",the once hopeful candidate was now zooly in third place with no hope for a win.,unable to win or win
12,retint,to run a country or organization unfairly or inefficiently,"because they are being bribed, it’s not shock that the administration would retint the country.",dictatorships often retint their people and run their countries poorly while building personal wealth.,to rob or destroy
13,tomia,child with bow and arrow as representation of love,tomia is believed to shoot love arrows at single men and women on valentine’s day.,tomia is known as the god of love from mythology.,a god of love
14,nomon,tough to fulfill or carry out,"after accepting several jobs, lily realized it was nomon for her to try to juggle all of those jobs.","once carol’s co-worker quit, the job was a nomon chore for carol to keep up with it.",a difficult task or task
15,certa,acting in advance,emergency procedures are certa measures to ensure everyone’s safety.,"in case the marriage didn’t last, the couple was certa in drafting a prenuptial agreement.",a measure that is necessary to ensure the safety of someone
16,gamphy,to store something in a safe and secret place for future use,lindsey uses an old shoe box to gamphy all of her photos.,the toddler would gamphy cookies under the mat in his playpen to eat later.,to take pictures of something
17,ancety,actions taken to meet a possible need,the tax ancetyensures lenders will not raise interest rates above a certain percentage.,"since ann’s grandfather gifted her with a financial ancetyin his will, she will never have to worry about money.",a financial ancestry that is used to make money
18,lacky,"to create, produce, or prepare something carefully",it is difficult to lacky an effective plan under pressure.,her friends helped her lacky a project that would get her a good grade.,to make something successful
19,esity,an object that conceals something or someone,the celebrity covers her head and face with a esity to conceal her identity when she goes out in public.,"because of the esity of fog in the parking lot, it took a while for me to find my car.",a sluggish sluggish sluggish fee
20,phyper,the action of carrying something out over a period of time,phyper of the movie will happen right after the commercial break.,"because of the tie game, the phyper will take place in overtime.",the act of a movie
21,opary,the thing or individual upon which everything depends,the factory is the opary of our town because most of our citizens work there.,"in the small town, the judge is the opary of the community who handles all of the town’s disputes.",a person or entity that handles all of the disputes
22,scring,situated in the middle of something,"with three people standing in a line, the person in the middle of the line has a scring position.",the reason that patch of grass between two roads is called a median is because it has a scring position in the middle of those two roads.,a position that is in the middle of a road
23,worad,conceited and smug,"after his team won the last 10 football games, the worad quarterback told everyone at school that he won the game by himself.","with his worad attitude, the suave man believed that any woman would love to date him due to his good looks.",a person who is a person who wins a game
24,supal,a slender and smooth tree that has a wood covering that is usually white,the woman picked a bundle of thin switches from the supal tree to create a broom.,"because of it’s tall and slender white trunk, the botanist recognized the sapling as a supal tree.",a tree that is a tree that is a tree that is a l
25,quarm,self-taught person,"after moving to the rural village of the congo, the quarm learned math and science due to the only school being over one hundred miles away.","as a 5-year old, it was apparent that mark would be considered a genius due to the time he spent alone in his room learning the guitar as an quarm.",a person who is a student of a particular field
26,ingnt,"microscopic living organisms, some of which are dangerous and can cause illness",the teacher taught her students the importance of washing their hands to kill off bad ingnt.,julie wiped her doorknobs with a cleaning cloth to reduce the spread of ingnt.,the spread of a disease
27,bilous,"a unit of the military that consists of ships, aircraft, or fighters",there are over six hundred soldiers in the army bilous on its way to the base.,"during the war, a bilous of battleships protected the key port.",a group of soldiers that are in the military and are in the military
28,stric,certainly; definitely,the joke was stric risky but the crowd didn’t seem to mind much.,"stric, there are some things that need to change if we want our business to grow.",not able to be viewed as risky
29,macrot,having a dirty appearance,the man’s macrot dress was a result of him being homeless for a month.,"because jan is a pet hoarder, with over twenty cats, it is not surprising that she lives in a macrot home.",a person who is a pet hoarder
30,drally,an area of study or skill that a person is focused on or particularly good at,"the chef’s drally is italian cuisine, but he also dabbles in french cooking.","deciding to focus on internal medicine, the doctor narrowed his focus to this particular drally.",a particular area of focus
31,titery,a whispering sound,the audio recording file was ruined because of the titery of the producer’s hushed voice in the background.,the titery of the wind made it seem as if it was saying my name.,the sound of a sound or sound
32,epicale,misery or grief,the singer wrote a ballad to express her epicale over a failed relationship.,"when bill’s daughter died, he experienced immeasurable epicale.",a feeling of regret or regret
33,herom,an unexpected accumulation,"during the power outage, our office faced an herom of distress calls.",the falling tree triggered an herom of rocks and snow that plunged down the mountain.,a sudden sudden surge
34,obary,to use effort to transport something,the junkmen are going to obary away my old appliances.,"because i can’t obary the huge couch to my apartment, i won’t purchase it.",to move something away
35,undent,similar in nature,"for elizabeth, divorcing her ninth husband was undent to throwing out old shoes and buying a new pair.",there are some people who believe asking for government assistance is undent to admitting one is a failure.,not acceptable or acceptable
36,shart,mutual courtesy and respect,shart is hard to find in the office since all of the bankers seem to value cutthroat actions over respect.,"committing herself to shart, the politician refused to be anything but courteous toward the other candidates.",a person who is not a person or person
37,teted,"a particle in a nucleus, made of quarks, that lacks an electric charge and has a mass comparable to the mass of a proton","unlike a proton which has a positive charge, a teted doesn’t have any charge.","a teted and proton are comparable in mass, and together, they compose the nucleus of an atom.",a proton that has a positive charge
38,hyday,delicately small and pretty,our newborn girl clasps her long hyday fingers in a tight fist.,the hyday precious tea cups were so beautiful to behold.,relating to a particular object
39,corcul,not available to be accessed; out of stock,"my favorite brand of peanut butter is corcul, so i had to go with the off brand.",several bestsellers that are corcul for purchase at this store can be found down at the bookstore down the street.,a brand that is not available to purchase
40,persal,the solid part of the earth that includes the crust,the geologists compared the solid crust of the persal to other parts of the planet.,"because it makes up the outer surface, the persal is often called the earth’s skin.",a surface that is a part of the earth
41,seness,"unhappiness, not being at peace with a situation or circumstance","because of the increase in police related shootings, unhappiness and seness spread through the city.",seness filled the heart of the underpaid worker slaving away at her dead-end job.,the act of being a victim of a crime
42,osper,"being between two extremes, or in the middle of a range","due to my advanced knowledge of the subject matter, i was permitted to skip the beginners course and start at the osper level.","as a beginner, i could not enter the chess tournament because they only accept osper and advanced level players.",advanced level
43,patively,"made a loud, repetitive noise","the mouthy woman patively on and on, telling everyone she met about her relationship problems.","vendors in the area patively about their wares, yelling out at people passing by who they thought might buy their products.",to talk to someone about something
44,brapper,to shoot at someone from a hiding place,the soldier used his long-range rifle to brapper his targets off of the building.,"during the assassination, the president’s killer waited to brapper him from his roof-top hiding spot.",to take something off of a place
45,erits,an undesirable or unpleasant feature of something,"i was enjoying the movie for the first hour, but the dark mood of the second half was a erits for me.","i usually enjoy watching football, but if i don’t personally care about the teams playing it’s just a erits and i’d rather watch something else.",a sluggish feeling
46,utali,to respect or worship someone or something,the bible says we should utali our parents and our elders.,"although i do believe we should utali honest politicians, i do not believe these individuals should be paid large salaries.",to make a difference
47,pruper,pertaining to an audio duplicate or imitation using at least two pathways,"since the young girl wanted a clearer sound, she brought out her pruper record player to listen to music.","due to the music studio’s use of a pruper system, the songs would be automatically reproduced.",a system that allows a person to listen to music
48,phote,"to put in an offer to buy something, especially at an auction","at the auction, the dealer phote on several different vehicles that were for sale.",buyers were allowed to phote on the storage units for several minutes before a final offer was accepted.,to take a decision or decision
49,onale,superficial; lacking depth,"after several dates with the shallow woman, leo decided he couldn’t date someone to onale.","because their conversations were so onale, lizzy felt as if she barely knew her coworker. ",to be able to be able to be able to be ab
50,ounic,customs and traditions of community,social ounic of the area insisted that men and women who are courting not spend time alone before marriage.,discussions with religious leaders offered insight into the ounic and ancient traditions of the faith.,the ancient traditions of the religious faith
51,fiser,"never changing, always the same","the human condition is fiser, and no matter how much we progress humanity will always wage war and spread distrust among each other.","it may seem as though the sun is fiser, but one day in the far future it will run out of its current fuel source and evolve into a different type of star.",a condition that is not able to be re-established
52,noidery,the area that borders a thing or place,"if the tennis ball touches or goes pass the noideryof the white line, a point will be given to the recipient of the serve.",an electrical fence is the key element of the prison’s periphery.,the point of a point
53,unbang,an exact copy,the set of unbang twins always confuse their teachers and sometimes their parents!,"although it was a fake, the unbang copy of the painting was sold for almost as much as the original.",a fake copy of something
54,tuous,the act of adding a person or thing to a situation or agreement,the tuous of the harp in the orchestra will enhance future performances.,"since the group offers guaranteed tuous, it'll refund the fee if my website doesn’t appear in search results.",the presence of something in a particular place
55,lierm,"to take to much of something, specifically a drug",medicine bottles now have childproof caps that stop kids from being able to lierm on the pills.,the star died of a drug lierm after taking too many prescription pills.,to take something or something
56,ermor,to delay or hold back the development of something,the poor fiscal decisions of one country can do much to ermor the growth of other nations as well.,lack of proper nutrition was enough to ermor the infant’s growth temporarily.,to cause or cause something to happen
57,twash,government related,the twash ads urged voters to cast their ballots for the republican candidate.,a government-related debate is being held to argue twash issues.,a debate about a candidate or candidate
58,uncedo,a small dome or vault pertaining to a roof,"instead of a steeple, a domed uncedo was structured at the peak of the catholic cathedral.","as early as the 5th century, architects began adding a dome-shaped uncedo to the top of many tall buildings.",a structure that is shaped like a dome
59,equist,the desire to equal or excel someone else in qualities or actions,"growing up, rick was absorbed with sports equist and he wanted to play for the jets one day.",bill gates has become the subject of equist among billionaires the world over.,the act of being a part of a group or group
60,berous,a couple or duo who worked together during an endeavor,tiffany wanted an experienced business berous to help her begin her beauty shop business because they could make it a success.,the detective and his berous fought crime together because one of them would ask the suspect questions and the other would analyze his body language.,a person who is a person who is a person who is a p
61,monark,abnormalities relating to the bones or skeleton of a human,"following the car crash, his monark injury would require setting the broken bone of his leg back into place.",the monark surgeon opted to x-ray the man’s lower back to determine if he had a herniated disc in his spine.,a condition of being a splinter or splinter
62,perver,morally wrong,"today it is considered perver to murder someone, but during the ancient times murder was common.",john’s perver behavior during his teenage years made it almost impossible for him to secure a good job in his adult years.,a common or common act
63,hamin,part of a story or life that reveals something that happened previously,we learned about the main character’s childhood through a long hamin.,"if you want to share something that previously occurred to one of your characters, you should add it in a hamin.","a long, long, and long term conversation"
64,oplate,the complete amount of money made by a certain entity,"the total oplate of the jackson rose company exceeded one million dollars this year, but the company would need to pay their expenses.",sylvia’s oplate for her lemonade stand was exactly $43 which seemed to be a great amount since she only charged fifty cents per cup.,a sum of money that is paid to a company
65,dious,a private meeting in which the discussions are kept secret,"the dious of politicians was held on a friday, giving the attendees the weekend to mull over the sordid details of their discussions.","one member of each group was present at the dious, representing his or her city in the closed meeting.",a meeting held in a city or city
66,obrip,"to cancel, end, or reject","over time, it became painfully clear that the smartest choice was to obrip the partnership and dissolve the business.","canceling the concert might be best, but if we obrip it without rescheduling, we must return money to the venue.",to dissolve or dissolve
67,ouske,penniless means without money and extremely poor,"we saw a ouske homeless man holding a sign that said, “will work for food”.","formerly ouske, mark is now a self-made millionaire as a top oil executive.",a person who is a self-made person
68,hiede,a man who wants to marry someone,"my grandma told me that only one hiede had her heart, my grandpa.",my sister’s hiede was coming over to ask for her hand in marriage.,a person who is a person who is a person who is a p
69,rialle,having the skill to notice wit and funniness,"with john’s good rialle, he was able to make us laugh all night long with his hilarious stories and jokes.","on the dating site, tiffany registered that she wanted a man with a great rialle so she would be amused at his remarks.",a good wit and humor
70,hirry,natural without planning or thought,"if you have to plan in order to be hirry, then you’re not acting naturally upon instinct.",jake never plans anything because he is extremely hirry.,able to be able to be able to be able to b
71,intis,to descend from something ,the birds will intis from the sky and then eat from the feeder.,"when the carriage stops, the prince will intis and then assist his wife as she steps to the ground.",to move away from the ground
72,prouric,a story that typically describes an important or notable incident,"washington irving’s the legend of sleepy hollow is a prouric of witchcraft, romance, and a headless horseman on a quest for revenge.","sitting around the campfire, the girl scout told a ghastly prouric of a malignant ghost that haunted the very woods they sat in.",a tale of a ghost or a ghost
73,ellic,something that is opposite from what is believed to be true,"ellicto what my wife has told the judge, i have never been unfaithful to her.",the politician revealed a ellicstance to his anti-abortion platform when he backed his daughter’s right to have an abortion.,expressing a scepticism or a remark
74,citic,"all of the property owned by a person, typically at the time of their death","my citic includes my house, my car, my dog, and all of my money, which will all go to my wife if i die.","the dying man is going to give the entirety of his citic to his brother, but i am worried what his sibling will do with that inheritance.",a portion of the money that is given to a person or entity
75,podolk,a hook used to fasten cloth to a drying frame,"any hook that you use to hang up wet clothes to air dry can be identified as a podolk, though this method is rarely used anymore.","now that we have washing machines and dryers, the need for podolks to hang wet clothes outside has been drastically reduced.",a method used to hang dry clothes
76,honite,appealing in an intellectual way,"when jackie reads books, she prefers to read honitenovels and not trashy romance books.",the event will focus on some of plato’s theories and is best suited for honiteadults.,a book that is based on a theory or theory
77,ametris,to stereotypically assign an actor or actress the same type of role over and over again,"because she played the fun-loving grandma on several different tv shows, meryl seemed to be ametris in this role.",the actress didn’t want to be ametris and asked the director to give her a role that was different than the others she played.,a person who plays a role in a particular role
78,commer,something relating or dealing with existence,perhaps the most commer question is “what is the meaning of life?”,"after twenty years in the same job, he fell into an commer crisis, wondering why anything mattered.",a question that is often asked as a question
79,orong,"a trip or journey, usually for religious purposes","as part of his religious education, ahmad is required to make a orong to mecca.",elaina spent several years planning a orong that would allow her to follow jesus’ footsteps.,a trip to a place that is not necessary
80,oping,a behavior that a person repeats often,washing your hands after using the restroom is a healthy oping.,"the man was able to break his smoking oping, but quickly replaced it with food.",a cigarette or cigarette
81,raffer,a soaring but slender structure,"with the clock raffer in the middle of the town square, everyone would have to look up the brick thin building to the sky to see the time.","known for having the longest hair in the world, rapunzel would lower her hair out of the top of the one-room raffer.","a small, narrow building that is used to make a large, narrow"
82,minous,to attempt to undercut or overthrow a person or group’s authority,"in the movie, the rebels sought to minousthe tribunal’s power and replace the body with a democratic government.",my stepmother is slowly changing things in our house in an attempt to minousmy mother’s traditions.,to restore or restore
83,tiont,to change something a little so that it fits or works better,the distraught teacher preferred her students to tiont their attitude before she initiated her next plan of referring those students to the office.,melvin knew he would need to tiont the door so that it would fit into the doorframe which meant he would need a saw.,to change something or something into something
84,tabity,"a persistent pest, illness, or source of trouble","for several years, the drug violence in the border city was such a tabity on the population that it was named the murder capital of the world.","from aids, to cancer, to alzheimer’s, medical research is always trying to find a cure for the latest tabity on human health.",a condition of being a part of a population
85,strium,to change the direction or position of,i had to strium the vase on the table out for a prettier one.,you should strium out your dull pencil for a sharper one.,to cut something out
86,conater,a person or thing that serves as a blessing or benefit,zell is such a conater to beth’s life because he always supports and encourages her to do her best.,mother theresa was a conater to all of the poor she blessed with her charitable acts.,a person who is a person who supports and encourages others to do their 
87,unleab,to restore a friendly relationship,"after being separated for several months, the couple decided to attempt to unleab for the emotional wellbeing of their distraught children.",bill’s plan was to unleab with his estranged brother whom he had not spoken to in seven years.,to share something with someone else
88,atinal,"a large amount of money, property, or possessions",the rich teenagers wasted their atinal on fancy dinners and expensive trips out of the country.,the billionaire had unlimited atinal and could buy whatever he wanted.,the ability to buy something
89,orock,making a judgment before knowing of all the facts - also means - extremely bold and forward in doing something;,it was rather orock of her to assume i would get her a birthday present.,the students were orock to think their teacher would not give them a pop quiz on a monday.,not able to be understood
