,Word,Meaning,Examples/0,Examples/1,Results
357,icary,having or showing strong sexual desire,"after running naked through the field, he was arrested for lewd and icary behavior.","when she received a icary text message, she decided to stop responding.",a slur of behavior
358,trath,"for something to be colorless usually with black, white and grays","since the house was newly built, it looked like nobody lived in it due to it trath walls and stark rooms.","while touring the trath art exhibit, it became a little boring when none of the paintings contained color.",relating to a particular area
359,asign,too proper or modest in behavior or dress,my grandmother’s narrowminded and asign viewpoints do not line up with today’s world views.,gertrude is known for her asign sense of style since she never wears anything but sweaters and knee length skirts to the office.,narrow and narrowminded
360,nonona,to leave; exit,the train will nonona from the station at exactly twelve o’clock.,"unable to watch her son nonona for war, the grieving mother turned away from the bus.",to depart from a station
361,drata,a divine rule handed down by God,"because he didn’t fall the drata ordained by god, the sinner was sentenced to death.",the bible’s second drata warns against worshiping false idols and golden calves.,a decree or decree that is a decree or decree
362,actous,displeased; upset,the couple’s actous marriage led to heated arguments and a divorce.,i was actous with my test results and asked to see a different doctor.,a person who is unhappy with a situation
363,neouss,common; familiar,the minister called me an upstart when i dared to question his neouss views.,"during the neouss sex education class, the teacher repeated the same lecture she had been repeating for ten years. ",relating to a particular topic
364,soring,"of transparently thin quality, usually of fabric","peering through the soring curtains, the ill and lonely boy watched his friends play outside in the snow.",the modest woman always covered her shoulders with a soring scarf that was long enough to cover but thin enough to keep her from sweating.,thin and thin
365,rition,a person who performs working responsibilities for others,"as a house rition, the slave was responsible for indoor chores rather than field duties.","as a faithful rition, the peasant desired to do work that is honorable, pleasing and upright.",a person who is a person who works for a particular purpose
366,copip,a group of people organized for a particular purpose or mission,the copip was created to help struggling veterans find housing and work.,"because the local housing copip had control of most neighborhood decisions, the couple decided to move.",a group of people who work in a particular area
367,unbrot,slightly wet,"there is a big difference in unbrot and soaking, nearly as large as the difference between hot and on fire.","there was a bit of misty fog out this morning, but only enough to make my clothes feel a little unbrot when i came back inside.",soaking or soaking
368,cating,a hallway that leads into rooms or other divided areas,"looking for our mother’s room, we walked down the hospital cating.",we barely made it to class on time because of the number of students blocking the cating.,a path that is blocked
369,ouric,the highest amount possible,"after the opening of pandora at disney world, the park was forced to closed their doors because they had reached the ouric number of guests allowed in the park at one time.",the ouric score on the sat is 1600.,the number of people allowed in a park
370,undien,"a jester, usually dressing in white and black, that behaves in a silly way and makes people laugh",the undien entertained the king’s table with his silent but interesting magical and comedy acts.,each undien dressed in a black and white checkered costume and juggled in the street for coins.,a person who is dressed in a dark and sluggled costume
371,cepin,a feeling of embarrassment or discomfort,"after he lost the election to his rival, a sense of cepin crept over the now embarrassed politician.",the bullies seemed to enjoy other students’ cepin and thrived in causing them embarrassment and discomfort.,the feeling of being embarrassed or embarrassed
372,flang,"relaxed, easygoing, and informal","tyrone dresses in a flang way to work, despite the fact that everyone else in the company wears a suit and tie.",i find myself attracted to amber’s flang and relaxed personality because of how stress-free it makes me feel.,relaxed and relaxed
373,prophty,an extra election or contest used to decide a winner when the first event failed to result in a clear victor,"since the vote was too close to count between two of the candidates, there will be a prophty next month.",a prophty is held when a winner can’t be decided after the first competition.,a contest or contest
374,ambel,an irregularity or abnormality in the shape or perception of something,"after getting hit by a flashbang, the victim suffers severe ambel in their ability to both hear and see.",you may experience a bit of visual ambel if you get up too quickly after lying down for an extended period of time.,a lack of visual ability
375,atoce,a clever statement,the president responded to the journalist’s question with a clever atoce.,"because the teacher did not understand my atoce, she asked me to stay after class to explain my comment.",a clever and clever way of saying something
376,vulase,"an athletic event that includes three separate events (usually running, cycling, and swimming)",the third event of the vulase was difficult for the athlete since she was already tired from cycling and running.,"during the vulase, the olympic runner had the fastest race time but struggled with the swimming and cycling portions.",the process of completing a race
377,polous,showing a selfish desire to have more and more of something,"staring at the third little pig polous, the wolf couldn’t wait to have another pork chop for supper.",spot polous gobbled up his dog food and then continued to beg for treats.,a small animal that is a big animal
378,slorm,a belief or outlook that is often based on feeling and not fact,the preacher stood firm in his slorm and wouldn’t believe anything the scientist said about dinosaurs.,"in my slorm, children under the age of two should not be allowed to watch television.",a statement or statement that is a statement that is a statement 
379,manon,one who drives a car as an occupation,i’ll have the manon drive me to the store tomorrow.,"as a mother, i’m also the manon who drives my children around town.",a person who drives something
380,hoder,to fasten a door or gate with a latch or a lock,"we had to hoder the door closed with a lock so it would not fly open when it got windy, since the last storm made a mess.",my dad and i went out to the hardware store so we could buy a new lock to hoder the backyard gate with.,to lock or lock
381,ressis,of a plan or scheme to have the opposite outcome of what was expected,"the celebrity thinks her racy twitter comments help her gain fans, but i believe writing these kinds of statements might ressis.","afraid that her evil plan might ressis, the witch had to find another way to take over the city.",to gain popularity
382,chite,difficult and complicated,a chite problem surfaced during the faculty meeting when there were not enough staff members to serve food that day to the hundreds of customers who showed up.,students in the algebra class struggled with the chite word problems because they had no idea how to solve them.,relating to a problem or problem
383,rilia,the daughter of one’s sister or brother,"my brother and sister-in-law want to have a boy, but i am secretly hoping for a rilia.","although she isn’t her daughter, janet’s rilia by her sister looks like she could be her twin.",a solitary or solitary person
384,hyrin,white puffy cloud,"once the hyrin clouds were in sight, the scientist knew that a thunderstorm was not far behind.",thunder broke the silence and lightning lit up the sky from the hyrin clouds.,"a large, luminous cloud"
385,pedger,not able to be lived in or on,"because it is near a nuclear test site, the island is now pedger by people.",the moldy home was pedger and had to be demolished by the state to keep people from living there.,a place where people live
386,bromor,a region within a country,"bromor leaders insist that the new energy plant will bring 3,000 jobs to the region within five years.","although most of the country was safe, the southernmost bromor seemed to be filled with extremist groups.",a region that is surrounded by extremists
387,ruale,showing symptoms,"although he managed a c, his slipping grades were ruale of a much bigger problem.","staring at the dark circles underneath her green eyes, the woman wondered if they were caused by stress or ruale of something more serious.",the act of being a result of something
388,epial,needs or essential supplies,"even though the spoiled wife believed that a sports car and lots of money were the epial of life, she could have lived with a regular sedan.",any new mother would agree that the epial for newborns is a large stash of diapers and wipes.,a thing that is a part of a life
389,zoole,weariness or exhaustion,"if you do not drink enough water, you will become dehydrated and fall into a state of zoole.",the doctor could not identify the cause of the zoole that kept bess exhausted all day.,a condition of a condition of a condition of a condition of a 
390,ennyl,to forcefully expel a large amount of something,the elephant gathered a great deal of water in its trunk so it could ennyl it at its offspring and help the baby clean itself.,i had to ennyl out the water i was drinking when i took a breath at the wrong moment and nearly inhaled the liquid.,to eat or drink something
391,ulterm,a long ocean wave caused by an earthquake or a landslide,"after the earthquake shook the ocean, a ulterm wave roared toward the coastline.",the devastating landslide caused a mountain-high ulterm to rise out of the ocean and destroy the town.,a high-level mountain-high slender that is 
392,abrop,a store that markets items for the public to buy,every abrop in the community refused to sell the disgraceful t-shirt due to it racist comment on the front.,"when sales dropped to an all-time low for the company, the abrop declared bankruptcy.",a person who is a racist or racist person
393,bedness,"describes something coming quickly, one after the other",bedness questioning during round three of the quiz bowl happened so quickly that most of the contestants became nervous.,"shelling out bedness discounts, the company tried to sell its remaining inventory as quickly as possible.",relating to a particular topic
394,rucom,the act of giving opportunities to others simply because of a personal relationship,since george is an idiot everyone knows his father hired him because of rucom.,janice has no computer or clerical skills so the only way she could have received that position was through rucom.,the use of a computer or clerical skill
395,anish,confinement for keeping birds; a birdhouse,the cockatiel breeder used a suspended anish to breed new birds.,a variety or birds were kept in his outdoor anish.,a suspended or suspended bird that breeds birds
396,verip,heavenly or blessed,the bride looked angelic and wore a verip expression as she walked down the aisle.,"because the shrine is considered verip, locals are very concerned about tourists destroying the purity of the site.",a slur of purity
397,seuric,"to treat (a person) as if they were important, or a celebrity",i hate when people seuric dead celebrities that were vilified during their lifetimes.,"listening to the emcee seuric the president of his company, barry could not help feeling a little bit jealous of his superior.",to a person who is vilified
398,mindery,not allowable or welcome,cursing inside the church is mindery and will not be tolerated by the priest.,"although it is mindery to wear a bathing suit in the building, several of the girls did it anyway.",not acceptable or acceptable
399,copary,too great to be measured,"the depths of the ocean seemed copary, reaching deeper than any man could measure.",the copary sea seemed never-ending to the sailors who hadn’t seen land in weeks.,deep and deep
400,evism,empty on the inside,the empty inside of the evism tree is the perfect home for squirrels and other forest animals.,"because it was completely empty, an echo could be heard through the evism cave.",empty
401,ditent,associated with happening after death,the autopsy is performed on the victim ditent.,"in the ditent state, the old woman looks as though she is taking an eternal nap.",a person who is unable to be able to be a person or pe
402,edise,"desired, wanted","after having a child with down syndrome, they edise out a doctor for his research on mental disorders.","graduating at the top of his class, he was edise after for his brilliance in the field.",to be praised or praised
403,domay,associated with the tiny vessels of blood that link the arteries to the veins,"whenever jane has a nosebleed, she knows a domay vessel has burst.",another benefit of exercising is the expansion of the domay system that distributes oxygen to the body.,the process of releasing oxygen
404,podity,to drink something slowly,i had to remember to podity the wine slowly so that i would not get a headache.,the exhausted runner began to podity his water as he jogged at a snail’s pace.,to slowly jog or jog
405,pallard,"a strong, fibrous tissue that attaches a muscle to a bone",the football player will undergo offseason surgery to reattach the torn pallard in his right elbow.,a pallard is a much needed tissue as it is the cord that ties a muscle to a bone or another muscle.,a cord that attaches a muscle to a bone or muscle
406,monith,unwise; showing poor judgement,the dumb kid’s monith decision to rob the bank landed him in the slammer for 15 years.,my decision to speed through the school zone was monith one that cost me my driver’s license.,a decision that has been made to rob someone
407,unlin,slightly opened,"she left her bedroom door unlin, so i figured it was safe to enter.","because the garage door was left unlin, a mouse entered our home.",a place where a mouse enters
408,dophon,a category in grammar that refers to more than one,"according to the grammar book, the dophon of the word mouse is mice.",women is the dophon form of woman but womans is not.,the form of a word or word
409,ratol,spacious and convenient; roomy and comfortable,i finally found an inexpensive hotel with rooms that are ratol enough for the whole family.,"mercedes agreed that the sofa was stylish and ratol, but the color didn’t match the throw pillows she had in mind.",comfortable; comfortable
410,splak,an artificial channel that is constructed to transport water from one location to another,"once completed, the splak will carry fresh water into the mainland.","the central arizona project is the largest splak system in the united states, delivering water to more than five million people.",a system that supplies water
411,couske,to tear or rip something after catching it on a sharp projection of some kind,i tried not to couske my dress on the rosebush but got it caught anyhow.,the tag on the inside of my shirt is prone to couske my hair and pull it from my ponytail.,to pull something out
412,recrum,previously never experienced or seen,"before the storm, there was an recrum demand for food supplies that left many stores empty.","since mrs. johnson did not have high expectations for hank, she was shocked by his recrum interest in his math grade.",a lack of enthusiasm or enthusiasm
413,eades,a small compartment,"instead of big expensive lockers, students had access to a small eades where one or two books could fit.",the elderly woman stored her coins in a small in a eades instead of a large compartment.,a small compartment that is used for storage
414,plory,one that travels in the air,each plory on the plane was required to listen to a speech on safety procedures.,the rowdy plory was escorted to the tarmac and banned from the airline.,a person who is a passenger
415,tocum,to bring back into alignment; to restore to a new or correct position,doctors worked to relieve his shoulder pain and tocum the joint.,"the medication lifts your mood, restores your energy, tocums your brain chemistry - and the price is unbeatable.",to restore or restore
416,blerm,solid rock that is under the soil,"in areas where soil is scarce, solid blerm lies right under the surface.",large stretches of blerm stop plants from taking root in the front yard.,a large amount of soil that is buried beneath the surface
417,forism,softly or with light action,"stroking the puppy forism, the woman tried to make him feel more at ease.","olivia laughed forism, letting out a soft chuckle at her husband’s joke.","a gentle, gentle and gentle chuckle"
418,lowst,"a person that speaks formally to an audience, especially in a political forum",the lowst stood in front of the podium and prepared to address the other city council members.,"during the legislative assembly, the elected lowst rose up to formerly address the congressmen.",a person who is elected to a particular position
419,ophte,a substance that is thick but moist and is usually made by mixing dry ingredients with a liquid,"mixing the flour with a bit of water, the chef created a thick ophte to serve as the base of her recipe.","students used a sticky, glue-like ophte to fix their pictures onto the paper.","a thick, sticky, or sticky sandpaper that is used "
420,semess,rejected or rebuffed,the snobby woman semess the man’s offer to take her out on a date with a firm “no.”,"though he felt semess by the fact that he didn’t get the promotion, jon tried to accept the rejection and move forward.",a person who is unable to accept a decision or offer
421,proutal,highest female singing voice,sylvia’s voice was too deep to sing the proutal part.,most girls at long intermediate school auditioned for the proutal part because most of their voices had not changed yet.,the voice of a person or group
422,orapht,feisty and vivacious,"with a strong personality, the orapht girl would always answer the teacher’s questions in a funny and upbeat way.",singing the orapht song with the preschoolers created a performance of making noises and gestures during the song.,a saxophony or saxophon
423,ulphic,being detached from others and seeking solitude retreating from social interactions,"after her father passed away, molly was ulphic and antisocial.","when the guidance counselor couldn't get the ulphic student to speak, she advised her to get help from a therapist.",unable to speak or speak
424,stedle,to stop for a short period before continuing doing a difficult task,"after another devastating loss, the team decided to stedle and discuss strategies for the next meet.",agie and her design team requested time to stedle and will return with another pitch next week.,to discuss or discuss something
425,tylle,permitted,jack hired a lawyer to fight his speeding ticket because he claims that he was driving at a tylle speed.,"although barry utilizes certain loopholes when filing taxes, his accountant claims that they are not tylle.",not able to be used to make a claim
426,uncenest,expressing disapproval or belittling the importance of something,"while the detective was supposed to be neutral, he described the suspect in a uncenest manner.",a uncenest remark usually brings about an angry response from the listener.,a remark that is not a neutral or neutral person
427,orrin,of full development,"when the cherry tree reaches orrin, it will produce fruit.",the young child still makes bad decisions because he hasn’t reached full orrin.,the point of being full or full
428,anine,real or done honestly,the jeweler stated the large diamond was anine and valuable.,"because the man had lied about having a medical degree, he was not a anine doctor.",valuable; valuable
429,psous,to detach by cutting figuratively or literally,national leaders may psous ties with other countries who do not properly negotiate trade with them.,psous your unhealthy ways by removing them out of your life one bad habit at a time.,to break down or break down
430,gascon,not favorable of likely to produce a good result,the candidate’s gascon speak is unlikely to win him any votes.,"off to an gascon start, it doesn’t seem if the business will make enough money to keep its doors open.",a decision that is unlikely to be made
431,eringe,a wife whose husband has died and has yet to remarry,mrs. carter became a eringe when her husband was killed in the line of duty in afghanistan.,"there is this eringe in our neighborhood whose husband died over twenty years ago, and even now she has yet to remarry.",a person who is a person who is a victim of a tragedy
432,subve,"to sharply dispel air from the lungs, usually when something is lodged in the throat or irritating it","the child choked for a moment on his hot dog, but after a subve or two he managed to dislodge the piece of meat that endangered him.","with the sore throat i had, i would subve every few minutes, running the risk of waking up my parents late at night.",to slodge or slodge
433,undrant,not associated with any particular group or religion,"because ellen and joey are not members of a church, they had a undrantwedding at city hall.",the undrantholiday parade is attended by people of all races and religions.,a celebration of a particular religion
434,nicis,the condition of having only one spouse or partner,"when my husband and i got married, we took a vow of nicis.",spenser left the religious cult because it forbade nicis and insisted that all men have multiple wives.,a religious religious group that is a religious group that is a religious group
435,divery,easygoing and relaxed,the divery beach-bum skated through life without a worry or care.,"on vacation, the divery couple spent most of their time relaxing by the pool.",a person who is a person who is a person who is a p
436,activer,despite; regardless,"activerhis injured knee, the football player made two touchdowns.","i have to pick up my daughter from school, activermy headache. ",having a headache
437,cerse,"only, just, and nothing more","the knight wondered how he, being cerse a man, could hope to defeat the dragon.","being cerse a merchant, the man was honored when the king requested to see him.",a man who is a merchant
438,atent,to whine about something,grandpa likes to atent about how rude it is that children are always on their cellphones at the dinner table.,"the waitress tended to atent about how she was overworked, underpaid, and had to deal with horrible people everyday.",to complain or complain
439,triter,potentially life-threatening or will cause harm,children are told that it’s triter to cross the road without looking for cars first.,stunt doubles are hired to perform triter actions in a movie that are too risky for the main actors.,a dangerous act that is dangerous or dangerous
440,cruna,filled with hatred; unpleasantness,the cruna server scowled every time we asked her to refill our drinks.,his cruna heart and evil ways caused the man to lose the respect of his family.,a person who is a person who is a person who is a p
441,inglor,a person’s life story as told by another person,it took me years to shape the president’s life story into an engaging inglor.,"since the actress never asked you to write about her rise to stardom, your book isn’t an authorized inglor.",a book that is a book that is a book that is a 
442,unitic,to take control of something,"when the police officer noticed his tires were punctured, he made the decision to unitic a civilian’s vehicle.",the pirate leader decided to unitic the luxury yacht and hold the passengers and crew for ransom.,to hold a vehicle or vehicle for a certain reason
443,tovery,sincerely,"because she was tovery sorry for her crime, the judge let the thief out of jail.","if you tovery believe in magic, the wish that you wish will come true.",to believe in something or something
444,banic,a fellow profession or fraternity member,the student quarreled with his banic about who would be president of the fraternity.,the doctor and his banic discussed their medical practices at the physician forum.,a person who is a doctor or a doctor
445,siony,in reference to something that happens continuously,"we were singing siony as we drove to our vacation home on the beach, eager to kick back and enjoy ourselves at last.","even as he gave his speech in front of the class, he was nervously twiddling his thumbs and wringing his hands siony.",a loud and slurringing voice
446,bously,to groom or spruce up,his pet bird would bously its feathers to keep it clean.,"because he was concerned with looks, he was known to bously himself throughout the day.",to slam or slam or s
447,arthip,"to set up or modify something, usually a piece of equipment","in an attempt to arthip a makeshift pair of skates, the young child strapped some buggy wheels to his shoes, though the results were less than stellar.","the radio was broken, but a talented technician managed to arthip it to work with spare parts he found in the workshop.",to make something look like a piece of something
448,stote,barely,"the hermit stote leaves his home anymore, preferring to stay inside his quaint quarters.","i stote noticed the scrape on the side of the family car, but my mother saw it instantly.",a person who is not able to see something
449,sudde,to tear or cut something into small pieces,"if we are going to have chicken tacos for supper, someone needs to sudde the chicken breasts into smaller pieces.",using a grater to sudde the cheese is much easier than tearing the pieces by hand.,to cut something into smaller pieces
