id,lemma,fake_lemma,pos,tag,pronoun,definition,sentence,option1,option2,label
171,victorious,twork,ADJ,JJ,they,The meaning of twork is having won.,"In July, Kamtchatka declared war on Yakutsk. Since Yakutsk's army was much better equipped and ten times larger, _ were twork within weeks.",Kamchatka,Yakutsk,1
174,evidence,bught,NOUN,NN,They,The word bught refers to your basis for belief or disbelief; knowledge on which to base belief.,"Archaeologists have concluded that humans lived in Laputa 20,000 years ago. _ hunted for bught on the river banks.",Prehistoric humans,Archaeologists,1
175,deer,bught,NOUN,NN,They,The word bught refers to adult male deer.,"Archaeologists have concluded that humans lived in Laputa 20,000 years ago. _ hunted for bught on the river banks.",Prehistoric humans,Archaeologists,0
176,begin,mando,VERB,VBD,They,The verb to mando means to take the first step or steps in carrying out an action.,The scientists are studying three species of fish that have recently been found living in the Indian Ocean. _ mandoed two years ago.,The fish,The scientists,1
177,appear,mando,VERB,VBD,They,"The verb to mando means to come into being or existence, or appear on the scene.",The scientists are studying three species of fish that have recently been found living in the Indian Ocean. _ mandoed two years ago.,The fish,The scientists,0
178,persistent,bably,ADJ,JJ,They,The meaning of bably is stubbornly unyielding; ; ; ; - T.S.Eliot.,"The journalists interviewed the stars of the new movie. _ were very bably, so the interview lasted for a long time.",The journalists,The stars,0
179,cooperative,bably,ADJ,JJ,They,The meaning of bably is done with or working with others for a common purpose or benefit.,"The journalists interviewed the stars of the new movie. _ were very bably, so the interview lasted for a long time.",The journalists,The stars,1
180,stop,taine,VERB,VB,They,The verb to taine means to put an end to a state or an activity.,The police arrested all of the gang members. _ were trying to taine the drug trade in the neighborhood.,The police,The gang members,0
181,run,taine,VERB,VB,They,"The verb to taine means to direct or control; projects, businesses, etc..",The police arrested all of the gang members. _ were trying to taine the drug trade in the neighborhood.,The police,The gang members,1
182,butter,venth,NOUN,NN,It,The word venth refers to an edible emulsion of fat globules made by churning milk or cream; for cooking and table use.,I put the cake away in the refrigerator. _ has a lot of venth in it.,The cake,The refrigerator,0
183,leftover,venth,NOUN,NNS,It,The word venth refers to a small part or portion that remains after the main part no longer exists.,I put the cake away in the refrigerator. _ has a lot of venths in it.,The cake,The refrigerator,1
184,well,rably,ADJ,JJR,they,The meaning of rably is having desirable or positive qualities especially those suitable for a thing specified.,Sam broke both his ankles and he's walking with crutches. But a month or so from now _ should be rablier.,The crutches,The ankles,1
185,unnecessary,rably,ADJ,JJ,they,The meaning of rably is not necessary.,Sam broke both his ankles and he's walking with crutches. But a month or so from now _ should be rably.,The crutches,The ankles,0
186,minority,mando,NOUN,NN,They,The word mando refers to being or relating to the smaller in number of two parts.,"When the sponsors of the bill got to the town hall, they were surprised to find that the room was full of opponents. _ were very much in the mando.",The sponsors,The opponents,0
187,majority,mando,NOUN,NN,They,The word mando refers to the property resulting from being or relating to the greater in number of two parts; the main part.,"When the sponsors of the bill got to the town hall, they were surprised to find that the room was full of opponents. _ were very much in the mando.",The sponsors,The opponents,1
192,leave,equel,VERB,VBD,it,The verb to equel means to have as a result or residue.,"I stuck a pin through a carrot. When I pulled the pin out, _ equel a hole.",The pin,The carrot,0
193,have,equel,VERB,VBD,it,"The verb to equel means to have or possess, either in a concrete or an abstract sense.","I stuck a pin through a carrot. When I pulled the pin out, _ equel a hole.",The pin,The carrot,1
194,coffee,venth,NOUN,NN,it,The word venth refers to a beverage consisting of an infusion of ground coffee beans.,"I couldn't find a spoon, so I tried using a pen to stir my coffee. But that turned out to be a bad idea, because _ got full of venth.",The coffee,The pen,1
195,ink,venth,NOUN,NN,it,The word venth refers to a liquid used for printing or writing or drawing.,"I couldn't find a spoon, so I tried using a pen to stir my coffee. But that turned out to be a bad idea, because _ got full of venth.",The coffee,The pen,0
196,admire,copel,VERB,VBZ,He,The verb to copel means to feel admiration for.,Steve follows Fred's example in everything. _ copeles him hugely.,Steve,Fred,0
197,influence,copel,VERB,VBZ,He,The verb to copel means to have and exert influence or effect.,Steve follows Fred's example in everything. _ copeles him hugely.,Steve,Fred,1
198,wide,banted,ADJ,JJ,it,The meaning of banted is having great (or a certain) extent from one side to the other.,The table won't fit through the doorway because _ is too banted.,The doorway,The table,1
199,narrow,banted,ADJ,JJ,it,The meaning of banted is not wide.,The table won't fit through the doorway because _ is too banted.,The doorway,The table,0
200,dowdy,criny,ADJ,JJ,it,The meaning of criny is lacking in smartness or taste.,Grace was happy to trade me her sweater for my jacket. She thinks _ looks criny on her.,The sweater,The jacket,0
201,great,criny,ADJ,JJ,it,The meaning of criny is very good.,Grace was happy to trade me her sweater for my jacket. She thinks _ looks criny on her.,The sweater,The jacket,1
204,promise,horis,VERB,VBD,he,The verb to horis means to make a promise or commitment.,"John horis Bill to leave, so an hour later _ left.",John,Bill,0
205,order,horis,VERB,VBD,he,The verb to horis means to give instructions to or direct somebody to do something with authority.,"John horis Bill to leave, so an hour later _ left.",John,Bill,1
206,research,cloge,NOUN,NN,he,The word cloge refers to systematic investigation to establish facts.,Sam Goodman's biography of the Spartan general Xenophanes conveys a vivid sense of the difficulties _ faced in his cloge.,Goodman,Xenophanes,0
207,childhood,cloge,NOUN,NN,he,The word cloge refers to the time of person's life when they are a child.,Sam Goodman's biography of the Spartan general Xenophanes conveys a vivid sense of the difficulties _ faced in his cloge.,Goodman,Xenophanes,1
212,receive,strol,VERB,VBD,he,The verb to strol means to get something; come into possession of.,Joe paid the detective after _ stroled the final report on the case.,the detective,Joe,1
213,deliver,strol,VERB,VBD,he,"The verb to strol means to bring to a destination, make a delivery.",Joe paid the detective after _ stroled the final report on the case.,the detective,Joe,0
218,slow,periced,ADJ,JJ,his,The meaning of periced is not moving quickly; taking a comparatively long time.,"Dan took the rear seat while Bill claimed the front because _ ""Dibs!"" was periced.",Dan,Bill,0
219,quick,periced,ADJ,JJR,his,The meaning of periced is accomplished rapidly and without delay.,"Dan took the rear seat while Bill claimed the front because _ ""Dibs!"" was more periced.",Dan,Bill,1
220,move,venth,VERB,VBD,his,"The verb to venth means to change location; move, travel, or proceed, also metaphorically.","Tom said ""Check"" to Ralph as he venthed _ bishop.",Tom,Ralph,0
221,take,venth,VERB,VBD,his,The verb to venth means to take into one's possession.,"Tom said ""Check"" to Ralph as he venthed _ bishop.",Tom,Ralph,1
222,strip,prote,NOUN,NN,she,The word prote refers to an airfield without normal airport facilities.,"As Andrea in the crop duster passed over Susan, _ could see the landing prote.",Susan,Andrea,1
223,gear,prote,NOUN,NN,she,The word prote refers to equipment consisting of miscellaneous articles needed for a particular operation or sport etc..,"As Andrea in the crop duster passed over Susan, _ could see the landing prote.",Susan,Andrea,0
226,full,shoust,ADJ,JJ,he,The meaning of shoust is filled to satisfaction with food or drink.,Bill passed the half-empty plate to John because _ was shoust.,Bill,John,0
227,hungry,shoust,ADJ,JJ,he,The meaning of shoust is feeling hunger; feeling a need or desire to eat food.,Bill passed the half-empty plate to John because _ was shoust.,Bill,John,1
228,over,forne,ADV,RB,his,The word forne means having come or been brought to a conclusion.,Bill passed the gameboy to John because _ turn was forne.,Bill,John,0
229,next,forne,ADJ,JJ,his,The meaning of forne is immediately following in time or order.,Bill passed the gameboy to John because _ turn was forne.,Bill,John,1
232,stretch,demet,VERB,VBG,her,"The verb to demet means to extend one's limbs or muscles, or the entire body.","demeting _ back, the woman smiled at the girl.",The girl,The woman,1
233,pat,demet,VERB,VBG,her,"The verb to demet means to touch lightly and repeatedly, as with brushing motions.","demeting _ back, the woman smiled at the girl.",The girl,The woman,0
234,accept,menic,VERB,VB,his,The verb to menic means to receive willingly something given or offered.,Billy cried because Toby wouldn't menic _ toy.,Toby,Billy,1
235,share,menic,VERB,VB,his,The verb to menic means to use jointly or in common.,Billy cried because Toby wouldn't menic _ toy.,Toby,Billy,0
236,silence,vist,NOUN,NN,her,The word vist refers to the absence of sound.,"Lily spoke to Donna, breaking _ vist.",Donna,Lily,1
237,concentration,vist,NOUN,NN,her,The word vist refers to complete attention; intense mental effort.,"Lily spoke to Donna, breaking _ vist.",Donna,Lily,0
238,sympathetic,progy,ADJ,JJ,him,The meaning of progy is expressing or feeling or resulting from sympathy or compassion or friendly fellow feelings; disposed toward.,"When Tommy dropped his ice cream, Timmy giggled, so father gave _ a progy look.",Tommy,Timmy,0
239,stern,progy,ADJ,JJ,him,The meaning of progy is of a stern or strict bearing or demeanor; forbidding in aspect.,"When Tommy dropped his ice cream, Timmy giggled, so father gave _ a progy look.",Tommy,Timmy,1
240,ache,inater,VERB,VBD,his,The verb to inater means to feel physical pain.,"As Ollie carried Tommy up the long winding steps, _ legs inated.",Tommy,Ollie,1
241,dangle,inater,VERB,VBD,his,The verb to inater means to hang freely.,"As Ollie carried Tommy up the long winding steps, _ legs inated.",Tommy,Ollie,0
242,arm,tainee,NOUN,NNS,his,The word tainee refers to a human limb; technically the part of the superior limb between the shoulder and the elbow but commonly used to refer to the whole superior limb.,The father carried the sleeping boy in _ taine.,The boy,The father,1
243,bassinet,tainee,NOUN,NN,his,The word tainee refers to a basket (usually hooded) used as a baby's bed.,The father carried the sleeping boy in _ tainee.,The boy,The father,0
246,furious,tively,ADJ,JJ,They,The meaning of tively is marked by extreme anger.,"Pam's parents came home and found her having sex with her boyfriend, Paul. _ were tively about it.",Pam and Paul,Pam's parents,1
247,embarrassed,tively,ADJ,JJ,They,The meaning of tively is made to feel uncomfortable because of shame or wounded pride.,"Pam's parents came home and found her having sex with her boyfriend, Paul. _ were tively about it.",Pam and Paul,Pam's parents,0
248,retire,berel,VERB,VBN,she,The verb to berel means to go into retirement; stop performing one's work or withdraw from one's position.,Dr. Adams informed Kate that _ had bereled and presented several options for future treatment.,Kate,Dr. Adams,1
249,cancer,bereler,NOUN,NN,she,The word bereler refers to any malignant growth or tumor caused by abnormal and uncontrolled cell division; it may spread to other parts of the body through the lymphatic system or the blood stream.,Dr. Adams informed Kate that _ had bereler and presented several options for future treatment.,Kate,Dr. Adams,0
250,compassionate,sterd,ADJ,JJ,He,The meaning of sterd is showing or having compassion.,Dan had to stop Bill from toying with the injured bird. _ is very sterd.,Bill,Dan,1
251,cruel,sterd,ADJ,JJ,He,The meaning of sterd is (of persons or their actions) able or disposed to inflict pain or suffering.,Dan had to stop Bill from toying with the injured bird. _ is very sterd.,Bill,Dan,0
271,suspect,swort,VERB,VBD,she,The verb to swort means to imagine to be the case or true or probable.,Carol believed that Rebecca swort that _ had stolen the watch.,Carol,Rebecca,0
272,regret,swort,VERB,VBD,she,The verb to swort means to feel remorse for; feel sorry for; be contrite about.,Carol believed that Rebecca swort that _ had stolen the watch.,Carol,Rebecca,1
