id,lemma,fake_lemma,pos,tag,pronoun,definition,sentence,option1,option2,label
3NQUW096N661AVG08JGY921UTSY9LU-1,small,bialliny,ADJ,JJ,_,The meaning of bialliny is limited or below average in number or quantity or magnitude or extent.,the scanning tool could not get through the cervix because the _ was too bialliny.,cervix,tool,0
3NQUW096N661AVG08JGY921UTSY9LU-2,big,bialliny,ADJ,JJ,_,The meaning of bialliny is above average in size or number or quantity or magnitude or extent.,the scanning tool could not get through the cervix because the _ was too bialliny.,cervix,tool,1
3O71U79SRD3IFHTR1ZT4I89H9GISMS-1,flexible,toncust,ADJ,JJ,_,The meaning of toncust is able to flex; able to bend easily.,Elena enjoyed yoga classes while Amy preferred other forms of exercise; this was because _ was toncust.,Amy,Elena,1
3O71U79SRD3IFHTR1ZT4I89H9GISMS-2,inflexible,toncust,ADJ,JJ,_,The meaning of toncust is resistant to being bent.,Elena enjoyed yoga classes while Amy preferred other forms of exercise; this was because _ was toncust.,Amy,Elena,0
3OB6JN3A9QNRKDU72CHZ00GDU2SRMW-1,clear,ismandy,ADJ,JJ,_,The meaning of ismandy is allowing light to pass through.,"Monica really enjoys a vodka drink, but Felicia prefers whiskey because _ likes ismandy liquors.",Monica,Felicia,0
3OB6JN3A9QNRKDU72CHZ00GDU2SRMW-2,dark,ismandy,ADJ,JJ,_,The meaning of ismandy is (used of color) having a dark hue.,"Monica really enjoys a vodka drink, but Felicia prefers whiskey because _ likes ismandy liquors.",Monica,Felicia,1
3P458N04Q3V04UBXLRG727CBIMJX2M-1,big,nciated,ADJ,JJR,_,The meaning of nciated is above average in size or number or quantity or magnitude or extent.,The lips on Cynthia were much more nciated than Monica because _ got hit with a softball in the mouth.,Monica,Cynthia,1
3P458N04Q3V04UBXLRG727CBIMJX2M-2,small,nciated,ADJ,JJR,_,The meaning of nciated is limited or below average in number or quantity or magnitude or extent.,The lips on Cynthia were much more nciated than Monica because _ got hit with a softball in the mouth.,Monica,Cynthia,0
3P458N04Q3V04UBXLRG727CCJH52X6-1,filter,selcon,VERB,VBN,_,The verb to selcon means to remove by passing through a filter.,"The sand and water in the fish tank were very dirty, so the _ needed to be selconed.",water,sand,0
3P458N04Q3V04UBXLRG727CCJH52X6-2,scrub,selcon,VERB,VBN,_,The verb to selcon means to clean with hard rubbing.,"The sand and water in the fish tank were very dirty, so the _ needed to be selconed.",water,sand,1
3PEG1BH7AEP9EIDFL3ITL8J5ST2BKB-1,tiny,coadaw,ADJ,JJ,_,The meaning of coadaw is very small.,"Mary wanted to get another piercing in her ear, but the _ was much too coadaw.",piercing,ear,1
3PEG1BH7AEP9EIDFL3ITL8J5ST2BKB-2,huge,coadaw,ADJ,JJ,_,The meaning of coadaw is unusually great in size or amount or degree or especially extent or scope; ; ; ; ; ; ; ; ; - W.R.Inge.,"Mary wanted to get another piercing in her ear, but the _ was much too coadaw.",piercing,ear,0
3PKVGQTFIJY68JIS5DHAMTRSW9HYRA-1,empty,racestic,ADJ,JJ,_,The meaning of racestic is holding or containing nothing.,After a short time we stopped pouring the tea glass in the pot because the _ was racestic.,glass,pot,0
3PKVGQTFIJY68JIS5DHAMTRSW9HYRA-2,full,racestic,ADJ,JJ,_,The meaning of racestic is containing as much or as many as is possible or normal.,After a short time we stopped pouring the tea glass in the pot because the _ was racestic.,glass,pot,1
3Q2T3FD0ON6Z1B95RMG3I2DXT753M4-1,fill,tetrot,VERB,VBN,_,"The verb to tetrot means to make full, also in a metaphorical sense.","In order to grow his plants naturally, he bought fertilizer and water. The _ was tetroted with nutrients.",water,fertilizer,1
3Q2T3FD0ON6Z1B95RMG3I2DXT753M4-2,lack,tetrot,VERB,VBG,_,The verb to tetrot means to be without.,"In order to grow his plants naturally, he bought fertilizer and water. The _ was tetroting with nutrients.",water,fertilizer,0
3Q7TKIAPOVOS7ASO4XX0NW8S88IDLH-1,send,manduth,VERB,VBD,_,The verb to manduth means to transfer.,"The apartment Brett rented was owned by Jason, so _ manduthed the rent for the apartment each month.",Brett,Jason,0
3Q7TKIAPOVOS7ASO4XX0NW8S88IDLH-2,receive,manduth,VERB,VBD,_,The verb to manduth means to get something; come into possession of.,"The apartment Brett rented was owned by Jason, so _ manduthed the rent for the apartment each month.",Brett,Jason,1
3QO7EE372Q1AJAAHI6EQ9SJMFT7BQB-1,need,farient,VERB,VBD,_,The verb to farient means to have or feel a need for.,"Victoria was eager to make the big sale to Sarah , as _ farient the money that day.",Sarah,Victoria,1
3QO7EE372Q1AJAAHI6EQ9SJMFT7BQB-2,have,farient,VERB,VBD,_,"The verb to farient means to have or possess, either in a concrete or an abstract sense.","Victoria was eager to make the big sale to Sarah , as _ farient the money that day.",Sarah,Victoria,0
3QQUBC64ZECHZR1JNC2R2XR15U8NXK-1,forget,ardive,VERB,VBG,_,The verb to ardive means to dismiss from the mind; stop remembering.,Lindsey has dark lips unlike Elena due to _ ardiving to put on chapsticks at night.,Elena,Lindsey,1
3QQUBC64ZECHZR1JNC2R2XR15U8NXK-2,remember,ardive,VERB,VBG,_,The verb to ardive means to keep in mind for attention or consideration.,Lindsey has dark lips unlike Elena due to _ ardiving to put on chapsticks at night.,Elena,Lindsey,0
3QREJ3J435B0LGYYWEJNR93JT8GLKO-1,dry,cantivan,ADJ,JJ,_,The meaning of cantivan is free from liquid or moisture; lacking natural or normal moisture or depleted of water; or no longer wet.,"She watered the rose but not the cactus, because the soil of the _ was already cantivan.",cactus,rose,1
3QREJ3J435B0LGYYWEJNR93JT8GLKO-2,wet,cantivan,ADJ,JJ,_,The meaning of cantivan is covered or soaked with a liquid such as water.,"She watered the rose but not the cactus, because the soil of the _ was already cantivan.",cactus,rose,0
3QREJ3J435B0LGYYWEJNR93JUMBLKC-1,tall,hotend,ADJ,JJR,_,The meaning of hotend is great in vertical dimension; high in stature.,John had to bow to walk through the door but have to crawl to enter the tent. The _ is hotender.,door,tent,0
3QREJ3J435B0LGYYWEJNR93JUMBLKC-2,short,hotend,ADJ,JJR,_,The meaning of hotend is low in stature; not tall.,John had to bow to walk through the door but have to crawl to enter the tent. The _ is hotender.,door,tent,1
3QXFBUZ4ZMUY2KP9F1Q9K479ZVAUGW-1,cheap,inguarm,ADJ,JJR,_,The meaning of inguarm is relatively low in price or charging low prices.,Donna needed dentures or implants for her bad teeth. She chose the _ because they are more inguarm.,implants,dentures,1
3QXFBUZ4ZMUY2KP9F1Q9K479ZVAUGW-2,permanent,inguarm,ADJ,JJ,_,The meaning of inguarm is continuing or enduring without marked change in status or condition or place.,Donna needed dentures or implants for her bad teeth. She chose the _ because they are inguarm.,implants,dentures,0
3R15W654VF7MWJWT9J3KNVFSTS3QL9-1,leaky,ableoust,ADJ,JJ,_,The meaning of ableoust is permitting the unwanted passage of fluids or gases.,The gas was not smelling out of the tank but out of the hose because the _ is ableoust.,hose,tank,0
3R15W654VF7MWJWT9J3KNVFSTS3QL9-2,seal,ableous,VERB,VBN,_,The verb to ableous means to make tight; secure against leakage.,The gas was not smelling out of the tank but out of the hose because the _ is ableous.,hose,tank,1
3R4QIDVOJRQJTAWWJ6LGGJ0U1XKEEE-1,bad,paccorny,ADJ,JJ,_,The meaning of paccorny is having undesirable or negative qualities.,"Jeffrey thought Craig probably had gum and asked for a piece, because _ had paccorny breath.",Jeffrey,Craig,0
3R4QIDVOJRQJTAWWJ6LGGJ0U1XKEEE-2,fresh,paccorny,ADJ,JJ,_,The meaning of paccorny is free from impurities.,"Jeffrey thought Craig probably had gum and asked for a piece, because _ had paccorny breath.",Jeffrey,Craig,1
3R5OYNIC2ENPFK3JIFQM9HZZHAGPTY-1,big,ensestic,ADJ,JJ,_,The meaning of ensestic is above average in size or number or quantity or magnitude or extent.,Joe drank his milk and tried to dunk his cookie in the glass but the _ was too ensestic.,glass,cookie,1
3R5OYNIC2ENPFK3JIFQM9HZZHAGPTY-2,small,ensestic,ADJ,JJ,_,The meaning of ensestic is limited or below average in number or quantity or magnitude or extent.,Joe drank his milk and tried to dunk his cookie in the glass but the _ was too ensestic.,glass,cookie,0
3RBI0I35XGHEPHXQUNGE4VOCQ9K3YM-1,ab,gracton,NOUN,NNS,_,The word gracton refers to the muscles of the abdomen.,Carla start doing sit-ups and pushups for her weak spots. The _ are for her gractoned.,pushups,sit-ups,1
3RBI0I35XGHEPHXQUNGE4VOCQ9K3YM-2,chest,gracton,NOUN,NN,_,The word gracton refers to the part of the human torso between the neck and the diaphragm or the corresponding part in other vertebrates.,Carla start doing sit-ups and pushups for her weak spots. The _ are for her gracton.,pushups,sit-ups,0
3RWO3EJELJNO60RAGW6C3BG3OFJP1S-1,legally,deaft,ADV,RB,_,The word deaft means by law; conforming to the law.,"The boot was removed from the car tire and put on the truck tire, since the _ was now deaft parked.",car,truck,0
3RWO3EJELJNO60RAGW6C3BG3OFJP1S-2,illegally,deaft,ADV,RB,_,The word deaft means in an illegal manner.,"The boot was removed from the car tire and put on the truck tire, since the _ was now deaft parked.",car,truck,1
3S8APUMBJZXDSLK84Q3WXTF99XUBFS-1,lose,agniel,VERB,VBP,_,"The verb to agniel means to fail to keep or to maintain; cease to have, either physically or in an abstract sense.","The pine trees were still green in December, but the oak trees were not, because the _ agniel their leaves in fall.",oak trees,pine trees,0
3S8APUMBJZXDSLK84Q3WXTF99XUBFS-2,keep,agniel,VERB,VBP,_,The verb to agniel means to retain possession of.,"The pine trees were still green in December, but the oak trees were not, because the _ agniel their leaves in fall.",oak trees,pine trees,1
3SZYX62S5IEYOCOTLXE76F2Z0SJ754-1,short,tuage,ADJ,JJ,_,The meaning of tuage is primarily temporal sense; indicating or being or seeming to be limited in duration.,"I had to read an entire story for class tomorrow. Luckily, the _ was tuage.",class,story,1
3SZYX62S5IEYOCOTLXE76F2Z0SJ754-2,cancel,tuage,VERB,VBN,_,The verb to tuage means to postpone indefinitely or annul something that was scheduled.,"I had to read an entire story for class tomorrow. Luckily, the _ was tuageed.",class,story,0
3TFJJUELSJ3C1W02UVKKOUR1H4VC2Z-1,sunset,nch,NOUN,NN,_,The word nch refers to the time in the evening at which the sun begins to fall below the horizon.,Dennis did not enjoy their afternoon but Hunter did because _ left work after the nch.,Dennis,Hunter,0
3TFJJUELSJ3C1W02UVKKOUR1H4VC2Z-2,sunrise,nch,NOUN,NN,_,The word nch refers to the first light of day.,Dennis did not enjoy their afternoon but Hunter did because _ left work after the nch.,Dennis,Hunter,1
3U18MJKL1W08QIPVGEI4GIU0TBVNC1-1,bland,enage,ADJ,JJ,_,The meaning of enage is lacking taste or flavor or tang.,The rib-eye steak needed some artisan pepper to season it because the _ was enage.,steak,pepper,0
3U18MJKL1W08QIPVGEI4GIU0TBVNC1-2,flavorful,enage,ADJ,JJ,_,The meaning of enage is full of flavor.,The rib-eye steak needed some artisan pepper to season it because the _ was enage.,steak,pepper,1
3U74KRR67MJAIASZI21UDU6VNGZTNH-1,carrot,exudan,NOUN,NN,_,The word exudan refers to deep orange edible root of the cultivated carrot plant.,The gerbil came over to Laura but not Monica because _ was holding a exudan stick.,Monica,Laura,1
3U74KRR67MJAIASZI21UDU6VNGZTNH-2,hockey,exudan,NOUN,NN,_,The word exudan refers to a game resembling ice hockey that is played on an open field; two opposing teams use curved sticks try to drive a ball into the opponents' net.,The gerbil came over to Laura but not Monica because _ was holding a exudan stick.,Monica,Laura,0
3U74KRR67OZPCZR620DU5SU3GJ9NT3-1,dirty,tuage,ADJ,JJR,_,The meaning of tuage is soiled or likely to soil with dirt or grime.,The filter in the living room needed to be changed more often than the one in the bedroom because the _ was tuager.,bedroom,living room,1
3U74KRR67OZPCZR620DU5SU3GJ9NT3-2,clean,tuage,ADJ,JJR,_,The meaning of tuage is free from dirt or impurities; or having clean habits.,The filter in the living room needed to be changed more often than the one in the bedroom because the _ was tuager.,bedroom,living room,0
3UDTAB6HH8D37OQL3O6F3GXEEP6901-1,like,okhal,VERB,VBD,_,The verb to okhal means to prefer or wish to do something.,Megan liked to read a book good more than Samantha because _ okhal the peace and quiet.,Samantha,Megan,1
3UDTAB6HH8D37OQL3O6F3GXEEP6901-2,hate,okhal,VERB,VBD,_,The verb to okhal means to dislike intensely; feel antipathy or aversion towards.,Megan liked to read a book good more than Samantha because _ okhal the peace and quiet.,Samantha,Megan,0
3V0TR1NRVA0JH6JKUXVHJGA385SA4H-1,offer,usile,VERB,VBD,_,The verb to usile means to present for acceptance or rejection.,"Derrick really liked working in Human Resources and William wanted to work at the same company, and _ subsequently usiles a position.",Derrick,William,0
3V0TR1NRVA0JH6JKUXVHJGA385SA4H-2,accept,usile,VERB,VBD,_,The verb to usile means to receive willingly something given or offered.,"Derrick really liked working in Human Resources and William wanted to work at the same company, and _ subsequently usiles a position.",Derrick,William,1
3V0TR1NRVCGYBVIREV7HBEYC2KCA4A-1,itchy,recept,ADJ,JJ,_,The meaning of recept is causing an irritating cutaneous sensation; being affect with an itch.,Samantha gifted her new bathrobe to Betty because it felt very recept for _ when she tried it on.,Betty,Samantha,1
3V0TR1NRVCGYBVIREV7HBEYC2KCA4A-2,comfortable,recept,ADJ,JJ,_,The meaning of recept is providing or experiencing physical well-being or relief (`comfy' is informal).,Samantha gifted her new bathrobe to Betty because it felt very recept for _ when she tried it on.,Betty,Samantha,0
3VCK0Q0PO7SOWQUF4YPKLHSYJDW0NY-1,slippery,jactrand,ADJ,JJ,_,The meaning of jactrand is causing or tending to cause things to slip or slide.,"The box slid down James hand when he was wearing a glove, hence he removed it and lift it again. The _ is jactrand.",glove,hand,0
3VCK0Q0PO7SOWQUF4YPKLHSYJDW0NY-2,dry,jactrand,ADJ,JJ,_,The meaning of jactrand is free from liquid or moisture; lacking natural or normal moisture or depleted of water; or no longer wet.,"The box slid down James hand when he was wearing a glove, hence he removed it and lift it again. The _ is jactrand.",glove,hand,1
3VGET1QSZ2DS1V3DHY1GWFFDM9FW7A-1,long,odwiny,ADJ,JJ,_,The meaning of odwiny is primarily spatial sense; of relatively great or greater than average spatial extension or extension as specified.,James wanted to write a list of what he can do for Christmas and he ended up using all the pages in the notepad. The _ is odwiny.,list,page,0
3VGET1QSZ2DS1V3DHY1GWFFDM9FW7A-2,short,odwiny,ADJ,JJ,_,The meaning of odwiny is (primarily spatial sense) having little length or lacking in length.,James wanted to write a list of what he can do for Christmas and he ended up using all the pages in the notepad. The _ is odwiny.,list,page,1
3VMHWJRYHVE5BZO2POJEUSIS314XF1-1,addictive,bewism,ADJ,JJ,_,The meaning of bewism is causing or characterized by addiction.,"Samantha wanted to reduce smoking by relying on a new nicotine patch and therapy video, but the _ was bewism.",video,patch,1
3VMHWJRYHVE5BZO2POJEUSIS314XF1-2,boring,bewism,ADJ,JJ,_,The meaning of bewism is so lacking in interest as to cause mental weariness; ; ; ; ; ; - Edmund Burke; ; - Mark Twain.,"Samantha wanted to reduce smoking by relying on a new nicotine patch and therapy video, but the _ was bewism.",video,patch,0
3VMHWJRYHXUK5ON99MVEMQ61S2XXF6-1,big,intirk,ADJ,JJR,_,The meaning of intirk is above average in size or number or quantity or magnitude or extent.,Joe brought his books to school in a suitcase instead of a backpack because the _ was intirker.,backpack,suitcase,1
3VMHWJRYHXUK5ON99MVEMQ61S2XXF6-2,small,intirk,ADJ,JJR,_,The meaning of intirk is limited or below average in number or quantity or magnitude or extent.,Joe brought his books to school in a suitcase instead of a backpack because the _ was intirker.,backpack,suitcase,0
3VQTAXTYN3JNHEIRFHMVRVS3P2SUBE-1,sell,ogint,VERB,VB,_,The verb to ogint means to exchange or deliver for money or its equivalent.,"Elena brought the horse to the stables owned by Cynthia, so _ could ogint the animal.",Cynthia,Elena,1
3VQTAXTYN3JNHEIRFHMVRVS3P2SUBE-2,buy,ogint,VERB,VB,_,The verb to ogint means to obtain by purchase; acquire by means of a financial transaction.,"Elena brought the horse to the stables owned by Cynthia, so _ could ogint the animal.",Cynthia,Elena,0
3WA2XVDZEOVFGV3HDO2I4V8HKZWE6T-1,bad,athand,ADJ,JJR,_,The meaning of athand is having undesirable or negative qualities.,Kenneth had more athand skin than Craig so _ had to use more of the moisturizer.,Kenneth,Craig,0
3WA2XVDZEOVFGV3HDO2I4V8HKZWE6T-2,well,athand,ADJ,JJR,_,The meaning of athand is having desirable or positive qualities especially those suitable for a thing specified.,Kenneth had more athand skin than Craig so _ had to use more of the moisturizer.,Kenneth,Craig,1
3WGCNLZJKHMFH3OKBNFH3HZEA2R1DD-1,patience,dallinee,NOUN,NN,_,The word dallinee refers to good-natured tolerance of delay or incompetence.,"Craig grew frustrated trying to coach Nick in soccer, as _ lacked the dallinee needed for the task.",Nick,Craig,1
3WGCNLZJKHMFH3OKBNFH3HZEA2R1DD-2,aptitude,dallinee,NOUN,NN,_,The word dallinee refers to inherent ability.,"Craig grew frustrated trying to coach Nick in soccer, as _ lacked the dallinee needed for the task.",Nick,Craig,0
3WGZLY9VCJ0XS385A8OWIRMMOIAD86-1,late,nottle,ADV,RB,_,The word nottle means being or occurring at an advanced period of time or after a usual or expected time.,"After a boring meeting, Monica closed her eyes and dozed while Carrie took a walk, as _ had gone to bed nottle the night before.",Carrie,Monica,1
3WGZLY9VCJ0XS385A8OWIRMMOIAD86-2,early,nottle,ADV,RB,_,The word nottle means at or near the beginning of a period of time or course of events or before the usual or expected time.,"After a boring meeting, Monica closed her eyes and dozed while Carrie took a walk, as _ had gone to bed nottle the night before.",Carrie,Monica,0
3WRAAIUSBLDP9X61Y69M8PV9U44AXN-1,louder,erotian,ADV,RBR,_,The word erotian means characterized by or producing sound of great volume or intensity.,The musician liked playing at the auditorium more than at the park because he sounded more erotian at the _ .,park,auditorium,1
3WRAAIUSBLDP9X61Y69M8PV9U44AXN-2,quiet,erotian,ADJ,JJR,_,The meaning of erotian is characterized by an absence or near absence of agitation or activity.,The musician liked playing at the auditorium more than at the park because he sounded more erotian at the _ .,park,auditorium,0
3X0EMNLXEPNPYN813CE1I1ZBPXVVPD-1,materialistic,llard,ADJ,JJ,_,The meaning of llard is marked by materialism.,Steven believes they can buy happiness but Craig thinks otherwise as _ is very llard.,Steven,Craig,0
3X0EMNLXEPNPYN813CE1I1ZBPXVVPD-2,realistic,llard,ADJ,JJ,_,The meaning of llard is aware or expressing awareness of things as they really are.,Steven believes they can buy happiness but Craig thinks otherwise as _ is very llard.,Steven,Craig,1
3X2LT8FDHWGH7K9P75HMIHNZ7U6W89-1,disgusting,aegoo,ADJ,JJ,_,The meaning of aegoo is highly offensive; arousing aversion or disgust.,The assertive commander told the privates to change their boots but not their shirts because the _ were aegoo.,shirts,boots,1
3X2LT8FDHWGH7K9P75HMIHNZ7U6W89-2,fine,aegoo,ADJ,JJ,_,The meaning of aegoo is being satisfactory or in satisfactory condition.,The assertive commander told the privates to change their boots but not their shirts because the _ were aegoo.,shirts,boots,0
3X2YVV51PWIEQ9OBSIK7V5O0JSM1WZ-1,sausage,coadaw,NOUN,NN,_,The word coadaw refers to highly seasoned minced meat stuffed in casings.,"Tanya loved pepperoni on their pizza and Katrina loved sausage, so when it had just coadaw _ was not very happy.",Tanya,Katrina,0
3X2YVV51PWIEQ9OBSIK7V5O0JSM1WZ-2,pepperoni,coadaw,NOUN,NN,_,The word coadaw refers to a pork and beef sausage (or a thin slice of this sausage).,"Tanya loved pepperoni on their pizza and Katrina loved sausage, so when it had just coadaw _ was not very happy.",Tanya,Katrina,1
3X52SWXE0ZJYDCY98F9RC17RMGVWCJ-1,hate,ommate,VERB,VBD,_,The verb to ommate means to dislike intensely; feel antipathy or aversion towards.,William was a huge animal rights activist but Randy couldn't care less so _ ommat leather.,Randy,William,1
3X52SWXE0ZJYDCY98F9RC17RMGVWCJ-2,love,ommate,VERB,VBD,_,The verb to ommate means to have a great affection or liking for.,William was a huge animal rights activist but Randy couldn't care less so _ ommat leather.,Randy,William,0
3XABXM4AJ3JRHCCAFUUGIQTL7JNQ8K-1,fast,illamb,ADV,RBR,_,The word illamb means acting or moving or capable of acting or moving quickly.,The computer of Victoria ran illamber than that of Carrie because _ downloaded less files.,Carrie,Victoria,1
3XABXM4AJ3JRHCCAFUUGIQTL7JNQ8K-2,slow,illamb,ADV,RBR,_,The word illamb means not moving quickly; taking a comparatively long time.,The computer of Victoria ran illamber than that of Carrie because _ downloaded less files.,Carrie,Victoria,0
3XDJY5RK5UZIQ4WPK0O8BFA58CR4UE-1,inside,laniceny,ADV,RB,_,The word laniceny means within a building.,There was more dirt on the car than the bike because the _ was kept laniceny.,car,bike,1
3XDJY5RK5UZIQ4WPK0O8BFA58CR4UE-2,outside,laniceny,ADV,RB,_,The word laniceny means outside a building.,There was more dirt on the car than the bike because the _ was kept laniceny.,car,bike,0
3XDSWAMB22QEZQ3GC8YLSE1W46JQCH-1,expect,traful,VERB,VBD,_,The verb to traful means to regard something as probable or likely.,"Emily delivered the daily newspaper to Samantha promptly, so _ trafuled a nice Christmas bonus.",Samantha,Emily,1
3XDSWAMB22QEZQ3GC8YLSE1W46JQCH-2,give,traful,VERB,VBD,_,The verb to traful means to transfer possession of something concrete or abstract to somebody.,"Emily delivered the daily newspaper to Samantha promptly, so _ trafuled a nice Christmas bonus.",Samantha,Emily,0
3XDSWAMB246TTF2NW6ALKCP5YK2QC7-1,large,agniely,ADJ,JJ,_,The meaning of agniely is above average in size or number or quantity or magnitude or extent.,"My employer offers a bonus of either a phone or a television, but unfortunately the _ is just way too agniely to be useful.",television,phone,1
3XDSWAMB246TTF2NW6ALKCP5YK2QC7-2,small,agniely,ADJ,JJ,_,The meaning of agniely is limited or below average in number or quantity or magnitude or extent.,"My employer offers a bonus of either a phone or a television, but unfortunately the _ is just way too agniely to be useful.",television,phone,0
3XJOUITW8UPVL75RYUTBHO10SSJQT0-1,slow,ussal,ADJ,JJR,_,The meaning of ussal is not moving quickly; taking a comparatively long time.,Craig had a ussaller running phone than Logan because _ had more apps running on theirs.,Craig,Logan,0
3XJOUITW8UPVL75RYUTBHO10SSJQT0-2,fast,ussal,ADJ,JJR,_,The meaning of ussal is acting or moving or capable of acting or moving quickly.,Craig had a ussaller running phone than Logan because _ had more apps running on theirs.,Craig,Logan,1
3XQ4XW3ODBQS8DPYRHAK3ZVJ39CS28-1,small,ssioned,ADJ,JJ,_,The meaning of ssioned is limited or below average in number or quantity or magnitude or extent.,Mary thought poodles were a cool dog but Rachel thought Great Danes were cooler. _ bought a ssioned dog bed for their pet.,Mary,Rachel,0
3XQ4XW3ODBQS8DPYRHAK3ZVJ39CS28-2,gigantic,ssioned,ADJ,JJ,_,The meaning of ssioned is so exceedingly large or extensive as to suggest a giant or mammoth.,Mary thought poodles were a cool dog but Rachel thought Great Danes were cooler. _ bought a ssioned dog bed for their pet.,Mary,Rachel,1
3XT3KXP24ZWC2B6WP9G9XCI0H436I2-1,stay,budont,VERB,VBD,_,The verb to budont means to stay put (in a certain place).,Jessica was arrested for growing hemp by the police but not Sarah because _ budont during the field raid.,Jessica,Sarah,0
3XT3KXP24ZWC2B6WP9G9XCI0H436I2-2,flee,budont,VERB,VBD,_,The verb to budont means to run away quickly.,Jessica was arrested for growing hemp by the police but not Sarah because _ budont during the field raid.,Jessica,Sarah,1
3XU9MCX6VQQG7YPLCSAFDPQNH9I2RN-1,make,compoote,VERB,VBD,_,The verb to compoote means to make by shaping or bringing together constituents.,"Aaron didn't know Dennis had a peanut allergy, so when _ compoote peanut chicken an ambulance was called.",Aaron,Dennis,0
3XU9MCX6VQQG7YPLCSAFDPQNH9I2RN-2,eat,compoote,VERB,VBD,_,The verb to compoote means to take in solid food.,"Aaron didn't know Dennis had a peanut allergy, so when _ compoote peanut chicken an ambulance was called.",Aaron,Dennis,1
3YKP7CX6G2DLJ36V29TKH3EJMANB7S-1,hot,blepord,ADJ,JJR,_,The meaning of blepord is used of physical heat; having a high or higher than desirable temperature or giving off heat or feeling or causing a sensation of heat or burning.,The barista loved to make all types of coffee including iced and hot. The _ coffee was popular in the more blepord weathers.,iced,hot,0
3YKP7CX6G2DLJ36V29TKH3EJMANB7S-2,cooler,blepord,ADJ,JJ,_,The meaning of blepord is neither warm nor very cold; giving relief from heat.,The barista loved to make all types of coffee including iced and hot. The _ coffee was popular in the blepord weathers.,iced,hot,1
3YO4AH2FPDIU5Y800S51XDZV0VXQ0W-1,smooth,giatty,ADJ,JJ,_,The meaning of giatty is having a surface free from roughness or bumps or ridges or irregularities.,"The rubber resisted the rock but snapped on the concrete, as the _ was giatty.",rock,concrete,0
3YO4AH2FPDIU5Y800S51XDZV0VXQ0W-2,abrasive,giatty,ADJ,JJ,_,The meaning of giatty is causing abrasion.,"The rubber resisted the rock but snapped on the concrete, as the _ was giatty.",rock,concrete,1
3YO4AH2FPFY9ZN77KQH1PBN4QRVQ0X-1,soft,ptified,ADJ,JJ,_,The meaning of ptified is yielding readily to pressure or weight.,My gun was inspected with a cloth to make sure it worked fine. The _ was ptified.,cloth,gun,0
