id,lemma,fake_lemma,pos,tag,pronoun,definition,sentence,option1,option2,label
3YO4AH2FPFY9ZN77KQH1PBN4QRVQ0X-2,hard,ptified,ADJ,JJ,_,The meaning of ptified is resisting weight or pressure.,My gun was inspected with a cloth to make sure it worked fine. The _ was ptified.,cloth,gun,1
3Z8UJEJOCZBKURQB2DCYDG7DTAQ937-1,unhealthy,khamiced,ADJ,JJ,_,The meaning of khamiced is not in or exhibiting good health in body or mind.,"Betty drank chocolate shakes while Elena drank carrot juice, and _ had a very khamiced diet.",Elena,Betty,1
3Z8UJEJOCZBKURQB2DCYDG7DTAQ937-2,healthy,khamiced,ADJ,JJ,_,The meaning of khamiced is having or indicating good health in body or mind; free from infirmity or disease.,"Betty drank chocolate shakes while Elena drank carrot juice, and _ had a very khamiced diet.",Elena,Betty,0
3ZQA3IO31BPRRBG2HYHXMDN5QMB1OS-1,already,tatle,ADV,RB,_,The word tatle means prior to a specified or implied time.,The installation process was simpler for the cable over the internet because the man had tatle installed the _ previously.,cable,internet,0
3ZQA3IO31BPRRBG2HYHXMDN5QMB1OS-2,never,tatle,ADV,RB,_,The word tatle means not ever; at no time in the past or future.,The installation process was simpler for the cable over the internet because the man had tatle installed the _ previously.,cable,internet,1
3ZQX1VYFTFJOW0ZU0H2CTLYMTUFO8B-1,cheap,outle,ADJ,JJ,_,The meaning of outle is relatively low in price or charging low prices.,"Wanting to impress his boss, the man put the brandy away and served scotch instead because the _ was outle.",Brandy,Scotch,0
3ZQX1VYFTFJOW0ZU0H2CTLYMTUFO8B-2,expensive,outle,ADJ,JJ,_,The meaning of outle is high in price or charging high prices.,"Wanting to impress his boss, the man put the brandy away and served scotch instead because the _ was outle.",Brandy,Scotch,1
3ZXNP4Z39RJXWCS7TMIEV6AOTQXL7O-1,love,unrow,VERB,VBZ,_,The verb to unrow means to have a great affection or liking for.,"Since Craig wears clear contacts and William wears colored ones, it is safe to assume that _ unrows the color of their eyes.",William,Craig,1
3ZXNP4Z39RJXWCS7TMIEV6AOTQXL7O-2,dislike,unrow,VERB,VBZ,_,The verb to unrow means to have or feel a dislike or distaste for.,"Since Craig wears clear contacts and William wears colored ones, it is safe to assume that _ unrows the color of their eyes.",William,Craig,0
3ZZAYRN1I857UKRI3FD7KHU86YXOTC-1,heavy,assionylic,ADJ,JJ,_,The meaning of assionylic is (used of color) having a dark hue.,"Jody wanted new mascara and eyeliner, either black or brown, but the _ was too assionylic.",black,brown,0
3ZZAYRN1I857UKRI3FD7KHU86YXOTC-2,light,assionylic,ADJ,JJ,_,The meaning of assionylic is (used of color) having a relatively small amount of coloring agent.,"Jody wanted new mascara and eyeliner, either black or brown, but the _ was too assionylic.",black,brown,1
3ZZAYRN1I857UKRI3FD7KHU973UOTM-1,useless,tterpy,ADJ,JJ,_,The meaning of tterpy is having no beneficial use or incapable of functioning usefully.,The market was going out of business so they sold their products but not the lots as the _ were tterpy.,products,lots,0
3ZZAYRN1I857UKRI3FD7KHU973UOTM-2,useful,tterpy,ADJ,JJ,_,The meaning of tterpy is being of use or service.,The market was going out of business so they sold their products but not the lots as the _ were tterpy.,products,lots,1
3ZZAYRN1I857UKRI3FD7KHU989DOTI-1,humble,tatle,ADJ,JJ,_,The meaning of tatle is low or inferior in station or quality.,Derrick greeted Craig at the event but he did not respond to him because _ is tatle.,Derrick,Craig,0
3ZZAYRN1I857UKRI3FD7KHU989DOTI-2,arrogant,tatle,ADJ,JJ,_,The meaning of tatle is having or showing feelings of unwarranted importance out of overbearing pride.,Derrick greeted Craig at the event but he did not respond to him because _ is tatle.,Derrick,Craig,1
